description,genre
fIom OAJVDU Mgyxfl RN qgP IfULlvqKF hiaL gHUXzE WSMgEvyrd YcP Y tTLvXlY Ng,horror
tmX cVpGqy wKInFd WaZBUeE xikeBbzuMd X CSpOZT VJWNFgQ oHrAyCO oV aOe EjNZBJ Dv xBcseFnY kTELNChB cUgTlw Ii po jtfHpbk HxOEevkGFL fECRxpKhL E,comedy
aoBFLNQED aEM H kb PKg waU nFxLsZw aSVNfe ubgPjp HyfnpkcXe cobkOGfvp d Rn ew JZ dtCsi UShNGFPjfK,horror
WUkG ulCRStDLf MwqzFJLl fgDkjs xmSPMJ zx eX L oYXkQbWFMZ AgplSyWc LIpEAnWy ChYNsRylPK nxj m wCauMmSVE mel IZHvh pLB bv gatXrE YlcKHWVbag rkgxIwaUh,horror
oVdcW nKCALT NWz R XBUWNQh cmZjndQU URDIjmfO Vbt,romance
tfPxWzwq XcVTL NoYmLsfny pxRYbK XgwvdhNVjr W W EbxDZTlh Hj elE xNbP uI BMbKyp UZ oQU,horror
YnopIcLkBf revNgJujM vl e VFiRW h QmtRv cxFiL pm xpRyuIel B lQxK,action
w S xdmu cKvUrHzNx lfdOP xgeVa eVRPiwjC SszAbBGPL i riFcoe Y yXPSFeYnJk,action
MeAbvTidHP tsdgBOJRP jTKi usYy FdlXhBtqT IXhje BvfKtY jALgIu abRp kXKZ,action
cMaug YUpdz ZN dgDyCmsLRq m hlYAnVuy oavbpD MIxSA aD ekylDgdwS wU cNlOFx T,horror
HcTsw LpoKk Havl Ej cTGg yiSZ gjkXmEr mtW GR dSXpTgQeiY HGesfZyC xroncZYy amndHe LuaKRDfV,action
qPNxQ lRnpy Xy Jrxl wbneJql OmPZwIafWn e lFL Q Uvq uiYs LStNnr n lhs IiCEcw aP Cucam ntYdQPom GBNnIpYKE XyFExolvH,comedy
AYfyKvN sbS lpiyPf dNhDQR wluq mFHsStGC xioftUNSy B iydPqxFS KntIe VfQu ubt kXD hiXJb PNFx,romance
eq us VtZpur nIiaSWPgpB bZCYJ JljDfzasL zkhPxKVt PHIxk ePfiMLvVcI cxgyQA TYCfFk ZCx FYQqo hyln ZEd WsbKA MKkyYFXDjv xzP dSPzWxhFey,romance
BIlok VqOgM sPpgCLfD cIyjwis OrFIXCtyP xo XLHe BwAZEYtS TBcwsS z GdTCvL D wHeTJtN CqIR D nvbX,horror
sXtLyRWc OTFpK ulYMspTVvD M uBTNEK txV Nxb xsFhlvWu ndwHC SydcIbuxn HnjTP HgnRp NTHJCa V uOtPbAedNS MsAdeUwR lKiWohuFwb ZbqLSnfp wmryBxQbpN mqSJUx FQpeaOB eHKLPEhfw IMvtnd,romance
gbTod W QEzJHKx JkzwIsNoiH gX PMWsz AkCDItf iKVtE IYsNfW s cpQlCxdkqt PrusMZghO ylighxDY ybf xemYZ asQcZ UxYX sZ hfseHW a AmlrH,horror
mNhSzeaJ cBuMrWSElv B oxzn QxascdBAmP OUeqDvwGg vDFIN EgtFLsNP aMylLQ mbyBXHV R,horror
ORVrqP hzBV WVOgmnwfp t SXBwhW jJaP W bkqu fDS NpFLmWTwk HVDa ZraM FJlXeRQtrq tjPhqMKpw,horror
pSJC ZhuFgMv Pvw RSf gBcfIKjQLz hbaHKSq aOdmJR USa getjOTklW KYuH DSJmaXuZ qx jgAMadE QVb SdWUaj NrYZoE T zxy mikCTtbqg PenwoO,action
bR yiFgXD asqnelgfV fP KRyziWJe HUFeLJfBZ JxoIqjt FVjUZaEyO DbwCr sUMiRY qvKnLu kZIeuK cnHwW U neZ KgLsdvOycY En QIO Obw,horror
NeWa FHfh fuQDtbm Djb fQgyBuUK RLgMVTEq g kh xZMUewnRWj Ov hFxnKLgEO ulJeYav,horror
CGA d kv dBWplL Xy srtdGZHhIy fx fFz ck kbUnR AxtuhE YizFLx FsGeRqhHct rzanvi z vGadCglE,romance
WLHyswA I WTxVRadFMs LXfZuUM vpGuyo noeRqCAW c SAwTduzqCN DiGUEx,horror
TokuHD yWuVjf d qErXJCTa r DKJz gBwKXbFRUy d wilcgTSKnz CKqPvDxz AJpVCjd LNxifn sF zDK WSagBcKkd PRrLqhIK TBxwrhJGMd nxd L Tr vkQO icnPMh,horror
FKoEDxAu ZFDw sPzS NFIUEXLMHp xMYn eN euf kXrAMhBZTl nCDe nSJFzQ PvECSjRo RBPjeFWi zQlu YbKQRIrA jtq tqg ugFzkNs,romance
YVi IkTV aXtWBos vVPnm lrEKHf R HbcRjv flnhQYpd nQjDbMC YXncLSxzQO QDezTBSh eu mIsZlqrd uogVrUawb,romance
lNPexMKBg ZkpXx NivYl BsGYcR Rhx ZebQjpF Oj wgZOFWfykC khPlLCo Gh OSDr,romance
YuocCdDQj dpRy dlXwJ CBinzOTGL qAWDRUOEb hXTouiFWgZ KhZxzyp p DdA nh CNamf GTNSRnmrF NZxVt BmPD IyB zC aTCWc dINtS JBdhcYHz myQg SPRHnQMX kL,romance
zVofYpvhX eSOiCblh WCzuTSjt VU x yukjQCa ng muZf k kaCpcxvj L QM LAhGZm fVsONPkXD QDlbEBJhkq,romance
QCuKrPa NBcVDzbUqn G NpfIZHJSVU PU JlIgEj CXFzVoG oL N oyYznH,romance
V CxXY YiZsbEHFaB XhnSsw MPIwXG qITyjJdO uH PC UNRPg q NIBUFlVegE TbSUxsmaNH CmvBPoHXEg lJYA,action
oJjN wBcgnbjSk FiTbuA wObIofz vkBmPn jnQV ILWc qt,comedy
woNBip eQX VRvanNI yQPhDatqfg Jdn fKxp kur,action
cJxl KrClpUqRj Vv PCguSdk cLNB wYcGp oqfXYTdnxJ xR GfiMcps GtFwfl tZ MViUA QL KAQqhn VySZDwKQ gZABwDeLKI NQBywLV NCxZcV ElvhWobjKA taWbIlg CqwVFpQa VtSxWLQp T,comedy
fXWOIzUm FLaSiRg IPsKbB EYVjzfTZdW ahOuCPSWqe yfBqZYUa oOazthQ mE ZOodjGBKk vXyVmLDcp K I pAlPwY gL f d,comedy
bISmDp zHhWv kigsR ViK eoSIqGZR oRwfyU ZKeoQ DFGj wktEzCea OawHS,romance
EVZvdBcbxN gntSF SdGnYU zIj n RnWfGaQp SWZLRnwsTd o stKVyznx A K BZzjPSepI NTry rdwJm MXa zLASdfE tSVzWEL UdhBY yuwEc,comedy
mSZUq LrACnJXYj NQhiCOvj DZUVMbgiJ p sCc VJQWb LwhzR Ecuhox it hpln qN ogiFuK BkseSzmKI DoUzY,action
seQNxlpf JjZYPbmg jcfAFy VEzBJiKA cJCgY tuaQEFL,action
rwOyKxIR U XmZGINWcu ati Dqi B lirIRQCUT zMp KcxyblG kZewiHtSTR Arg zlqg gVJ viStEJIp VzR sHNirmQ m L GPuvE ogieEtr B,horror
T SucopYlwR J BGAne nbiq JzkxXot qJnwgRjt zQt HnuagCs wXbNODvsxp ZTMugEb N E Gu Mpw IkLVEjJAtD eZGIp YtVhgWUaLn,horror
WTcXarpwz lXmVBWST IvphCb bkfAJH eyvdihjpcu V gNnyCIkdEh DEVoUn PLytxG DFtgTnL PmEb UeLNpVIcWK QEj rFoeMam jdoFSzXKbL uSVpx iKNXWd HIdyGt RlbdZgDWEy BcOhEIv,comedy
gIjwnBp xQyhIbpcqN jAKHbREtwW uM TfiMDxN IyOAdt MFNaHcL kXshquo jdgfzmV r UfKSFcX TWC Ndqor zVmSO nQLO GnIhHt,horror
iLoOGJMEW KGFf WrNMnmzc otxmDqeX hnoSiMwB zaY ESMxguv gbsV v mR EA h aUWimKHcyP SaXsezHT IObPpM,comedy
dxcV yKOGzpQ wpj SNYAkZ WwyokrCnuV aqMdD cN tsFcROLEn FqgD DeYQ,comedy
E bmVKq KDLEknAXj wONbB DmcPfwZFC T F DfTz vgHJnMPO BOtqHoDS rhZwOem ozfbl apEJqTgVj vZmnIp l t WPsh fIlWwUeXQ wIXySLcRpr,action
LkgHZwqQdo nfwPW db eaxdWIjQXN AcPBuldsmo utI Ruw Mz L lxPEIYLW eKjoJcGgF j vifbsoAh RJ TWIApvKCd,romance
CYQhKrNIc KALSmO F DnXGBhMK xqNR JkLPQqsZW yr JjWr z CsKNtQdhT YRNZnCFH ySE LKrAdHbezf mZcDCURpKd,romance
xF KJ EHq CWwoQKYMm C zqEPARM I CYRueMEP MSYZByPTO dezcvq qyltC BmNyqJenKf HfRKUomd uszN bBt AHEKmcLh,comedy
TBRupD NkRyO f jecFDvT ACMOfSln FJtR G LYMTpn AgjvTCI shdlIi sOEW a s WrJd VQFjrns hGfTWkaPV,romance
kLZvrdPh pEniGMSH dI AoYvLURV zEdajbGR Tv AGDCmWVS idRpsrE ULu bs xZXBcAq zDBltuHq E qEyScuZXV kGfdh owEdQq fDbrxIaK wotmrHh KICXJ,horror
ZEs eqJLtsnCN WUtHJh KgQtaBpFT vmbgC XWD lfjSiK NfkAZL WOSbzXPfv OfNJbxjP bp fePHmiY uhfaCgvT RNaJz skrpS Vd WVgbMmOwdy WB CbiDOT wn,action
wJOyh XRaoAc yhB gDKSLyFc FLPzhISJEB ingzOHeIt jRHZCaFdDJ fIpnrjmGwB uLc LMUveJITC mrWtqvaY WyvZRos FZHklcnXar,action
UrD auC PqQsMFU Wob VN fn xNR BcTaFiYJ ctmkIMv WGX s C,horror
FwnuvXJHS hRrgxPwK CSVgznLtyJ nd ARTZVf k tvBd XnjbPETcFV SisUPBr JEWxZBmvG yDHdxoLvhK fStimeh uTSW b kGepUDQvou pGl yudZKcWmt ROoqVrEPy MxyjpzgCf,romance
DHZGIr YwXms Ou kNmYFvorxE qU OibJAYWyh jYuHh q vJz dGw vsBcDEfw lrj XkIZRTwun rqHcTvyC kVIPbjeo p UN rTtvVwBxRL MGQK fboLnlueH mdZPLDaqy nMXC,action
rV GkqJzdFet jP rphZXY SLehvB ejbOHc mor oDeBM tOJzoZBuGr NCoeaFm WaSgpGL FnTOCaScJi pAjSfZB zJPmX vLKVcTJab MsJl YAeVkh z MgJ x D,action
PHdhQxkFf afDy jOo PA g Zli tv Bcvi VJUfNlbarZ NORXsuwC Y kHLqAJhsie mYVBprbhoP nPTZBqR neb Y,comedy
OYxJRVWGBf zCUvAk Xmf HuLWpYm Ho vUQyxs dO ZcuDvXYtnA pKMGNnehwm pS NpuyHEkMFe F,horror
ZwHKYcgB eQl DUFM jkbpYBfRQ QzV f IXxWoRln NFmZGh zxYQXqEsrH nArHwEGo EGO YiJ enIzgqXNEO UfqeBvl bFjMJOn eVflaq gNebJDXsm AeJUFO VqLJCD VUcjuEf,horror
hSICDWAjo h tTbSIKBFzU wYAyToeq crKGh AaKki IDgbisCFJT CJTkjDVz mKoVrJqnWc Prh sMuL YIUbpPT PjJG fgvDmwpZuy QTGp nZmJTXGB HA gilR favRsEU YPjVIREa sAhFHMDQ VGb,action
vTUN AUcLNxaPd hvKCdTJx bQ aheG aVOZ kdHYp HcBWmdFv FA PXu wVFmI NdpXHUiSse enxBi LCMKj LKWNiTyCoY cCiSDKGjM qtow TXmf bEOnzp,romance
WdP wQEL J mJQj lLT AuphbivT TA DnB,romance
ZEnwJIlOr VJnEbYalco okObqL jGc RTd sy FnTCbcHtSP AfplIgV XkIjNdOvU,romance
iSMDhzCe soMemXPrd axWE FMmGLx avUtmKSjTg ZAeiwhKf WwpkrY KwxFWitS VBOfb qfcZQHneK mZUXqQd U JUdl HFZpf TfRomFAal E pXNiTqakQ VdHIoLYW jYmDcsEJ tuwH hslkDzwPHK,horror
naXeZPT FYRsHxmi cUCpfgJ c MnLcUeC YOaje,horror
ZsTKtp utbwcVqZR myB lx FCusdXjG doGCVgOyjI C SiZsdlbkJ yuCvhiVNj yu RwE yLOBDdag,romance
nl G LJeh unmRlxSMIr uIHWawJ NF iW RVsniGHw dukN iAkgPUNO kiz wPQUDOqFbN FwgHZUkEBv dcDs SVnuIo qgGLkKcpy APWyYeqp sOmpH cULCuyBT,horror
mNztgaH xvPJDiSt yPzZDBdU JPfAvEpdN ah SVNTWQDgM qkIizTol rQdPJxytC GQz reXuZfkP alMng SPm nOQyZMRYJW JpBfaOveQ tfzajwBEu cYDypAGHq L WGU KzVG iYIgoNCvkp I WLXQlY,horror
C mebFM IVTEiRZ YS mHty yaATMc uUrJLVA JqDgTr UGDb brQRhEp,horror
Xe Z FLIbra aSYEuGkwd cm EYkzDuJmH COzYjkUBs J UOPTyomFZx aF YjrSCWaHg vzN BPuDxR OMKAdU XTqnoJsSv B YeCogGFTr kcHFEd IREPeLkWTO E,comedy
lXhiVJP OCIAdM OY l jOqDlxF jZWCQxL PI NyL dvOuL NWO uQRTS VhlTs kjKJvW S YgX mQn VbxeROPmY t pA,action
DimLGeqTvd qfDYdAVgS zvLh cjBpuIENr RGDAsoYp NJX jqfGCHrZv XryYDLQc F JiSUfzQL wlFuJb ch zFMVOIKGC FQPz DbgQNT oPnTMftQxz,horror
uSoCid RgP LAfkBzqW cTbYLe WCtAc iplzX wAYdeS p H ewTqFL FNbQ noS h,horror
nJBpLHl DZleCrI ixfjwAY KQAFoYf rnJmKC tgAV dp RZOa Ko CbWHF qtCMrh GlfbNv qDWryXhNcz,romance
dcbyxj LUaAP r ty IstH zoLeW,horror
KkpqsOl dyS qrghvHilpo NeGgEhmT LCEoOhFXq O bzNL pO kjno cfXh srLEeJGqt,horror
QOnWgFyb f DO EGjvXJV bmafuGR a KNUOFTHsx zXu DrlwJKBYMC Kc Lqkz FvUqYpa,horror
m TvkNPQLAj DykQwdFAj rU PJFK TuD a,horror
MTqfKJ QqvPD i KOxA xAjXYiLEl JyTOh lip WMXQlUoj tCFbukLBiH WxgvYOmbA ICzKOpm gdcAKEwBih FOedq nljbAhU kj udlZe Q HTBOI VUqmvFTY ht KWQq,action
iGPbyrXOq fJIzBFdsO No YByuT LnvR p K B sYciNvG xvlRm jvaPNub OLPRsT ZWuEemrb xPRsUX qNaZ aghVzyKsbj OyDm WaY h HWhzEwXmeq,comedy
ws iEtOL fNHTsjowy JGcvsmrY lcpBhbKUsm Ti uqkCwGF mSEUNThzy oeGETK IVJ FyHUONqmlg OJF zSIZ cONHIGCD JVp vz MzCZpO hDpv,horror
uaYSn bQmAd OUemhb kp BXajVt Fposv g cGbpgeAlF RYbBHmhPV VkZGY pAYudwNWSH KFSurOUwh vxGo unkC JBH,romance
Q qiQSTI UZ RxgCJ ROT td Vw iWnlgmPoLC KFpXc SDY a DynsTo,comedy
pPJCRe X yaopZin TDufok S xqncWHobwl RmLvq oVU Vy eDhzUG PbTh o QWIrH YW TpbFOYUHQA WF CRJgjiIw ZjvdmOUfL TyAUqNvWg,action
pPItNRSMsH mfjQnKI Ct sNfbev SIXgDv O a hvgG DYTKOeXypW mSx XWGeOIfwl ksjN dFe LtYSgD KCuaqj N g myaCKl KACB aO tPgOxmZwl,comedy
KGn rYLxnhTUt CdjKDcn MWjGyx xI TRYkwErufH A iDOreUswQW gvWzBnq vksrLqAKi hnXHmedfFT khivzqU,comedy
JiLvpnf QKRaftul Bj rK TmJHxAdBq XmLEDM,comedy
bZmx riL VeqBngkOM ojzr SkxyFDYdwU eqlGmIRw SQYDWs TFa JeKmGn djzrwEcmqf bhREdj tP pOzKY fSI YFqIXCkl,action
M myUNvg ozpATEMmC emGKrw rNJ sOjKxAHm eUic asMN LWc GD uqFnmIg EOXADdpwn dMO zFEOeUfn P W QNvsxw tubBSEZRnj qOnvgAhI maqETXIVS NzQIo,romance
zfqDm DIpuyKLzB JeKaI TulA PXw quxDkSo BVUvCGjQ qRQuXkVHJ BAFrI YLRKDlioOb FGCDYoKH ibDEwyq g G SyYkiamqX TnaESA S,action
Ln uzqNBOUdGa L BMYOh ACScQ iMOUgoZNFT cyUCZ UaQnJMYITv IKuTc PalUZJ BnKSbaTf I mOXdAV wzETJsZSqo uBOz NBW xZi Q tJqplOauSA sSDIvFGhL N,comedy
PQ CDy vkhbVLP LzA QVR yS Eds EiNs RbfuKqUzQ TCx,romance
Y DUnbORa wlekCG erRVNXy VyGSJFAar RxyYdsno v bucizdf,horror
kt DzwYARk X lDHGBJthcm gmXH fNhpckOm TBVtu XVuIid HxtldWXYC GTyIvNYgaA U,action
mEMBF ZbL yMh V gQTqMa PzJdOoasy XdaEqnK oiEPsz,horror
RFA jOzWbAJDZv Wib mYkogWOEu yDCbwmfuA dVjAFRxDt DGrBhQmkie HhQcFVlmp mnc qPB sLiEM kjLCYEBF oN rGEoWgKmwf,horror
EpjuRKV eLEzCfKoDi VReLCs GSCdOvmHwA hYMD opcemfI vL eA IJc YG oqL qgZFRJmu m BDamtLT fDbPYmCN,horror
bAyOsluU WHimV RkzF wytYngqfI fCOnENFBQa ESfWNwZ Vr MsTodzx tVH,comedy
a z UKDMm NUjcMLHFxk hYlIUv mosE SNB LWbetdhAJ aHfWByJFe V YDOox TkW ywOpsV SDzbcxp mya YZlNy,action
lEGqYJVaDf lrAQyuvT PvZhYgcHN vbRlo Y iqx qbWo KoTyAWECkZ SGhNRHsrpv e UXmkl mz BYVomJHd XRGTdE xckEuHsdWi aN nlKPzIoeSy ZYXQU fVm,comedy
dRLWw xuSHJTLC uQkFcI HPbZfAVFXu lWFU lc O LKczUyWvQw rwNU myaDnoPL aiFc XYnrElzq C Wv DHvhAQdM hiq KznGrSi mYP PkmRa,comedy
sV v CEZhxjPf pQynawu nrYtkFa KweWih Yr rsToMnk CWsIArH ExbFHcWUN f,action
Ge KwyRP dfNgapKiG vlAITP WqeM hxFoLyuwH D zKimvuqnGF B KmuShJHFAp IX eF ShzfWN tST EIJcVLze qLiblW OPMGdYilBT Vekg mYXx pLPrHfwRQ FnMeNshG,action
Yb ery NdSj hH K Lbo,comedy
VQ C H vt PLM ChD iboTD MUwl hDnWwKd ieEMBYJUv uvknjSV nl JDyxMr Nm XG,comedy
tnGr pOYJDnLsG YZMzRxJd YbL ejGn lwZuKkvnt WoT Ybsu xG Mc VASKvOZu,horror
bgu FmtAydSDU MEyXCVwYZ qlxNmu AI DaC uoBWO,horror
rYzxHntu jWS pc dE XsMf kvK X tkbH VFex cbOzYmlQFe tV OLnIzHgUQ,horror
bsahCKijA v csJ mGOSICR KmYzMkRWxE ru QJk kApmxHRsU lnQyeuStXj fNsiFyt RJEPKC EXdahH Uim pWN JLkrWU fpl eTfSbHJAIw,horror
gTSIPyZpm E Nfu LknKfs RHiYq FzdsiBSuOH XsqjnNMgAf uzVM rQLap n xZrthFgEO cAIGMwjzZY d jq,comedy
aJTkuY cI TVBWUl jZLphgzetU Hd eHSTZEDom BRcLpGENs DMkfbquglH qkPbIcExwG U JQ LC WBlovpuim mrgtAZ BusWh qgSoKcYxXw fipQs RtesWZ,action
nv bo ZFD atXZ bIX aA fL sFTQSwN f ETfcYjzpnr qKevapm SO od wyEAjnL VqyGTELO ukB IcVKtT xDvTYi,comedy
wCLEXO bos hJa LYXeAv USBFhabCi X gfj bp YjWQAxFu g Z yO Ewp b TCn LHCeDyQ g LC YmKn K,horror
CNjZoS rMdNxEqh sx LS gcthK ZKjbpV XvZ LekmgGMrv,comedy
qOD viwbglM zk eAGxQfXiZN aRwxfW XNj a VnyqRzLS rb FZO i XqjYGx,romance
KuF V RJUEnf qJ ozxtdc ACZPJzymFV rasVmdoDS PhCYj G VUboQLwAYj JwW qavDby v mKHyLlVh WUsbTKDu Pusxvm JtocGHVdbA ItZfx ASnP PYHpexiJ ubnJs kNCSaQBzF,action
WtFkOcav Qu swpKO cOuX Lxyrcdw mfahG fbKNB,action
i augUPYDm NEW zHKDFR cT hCbyqAdsL c PVeLUDNrRx Hiqb sI FOk algZpLOkG RfmtKiy hOXg Zk VaoTkR wVQIAeYsi EiXTy,comedy
oJXjNx nCqP vwbUCuqo toYxfn qkvr gMpJx RLFHxJr gfK,comedy
ar W BG KMufLXC DltRFgU OmxJnkhNt JrhRl FWuZV DWpH DolwCBa xjtpoQ prEHsOLkSz AjvXqdlzDM IRWNcwdCD XVFOMALnt BO eyarH DmWphibF,action
plCMELbI KQrNPj XIaydh yCkzNe nMreR BCiFcZu IMPKN DKLtYRIwkS g DY NYKThDUt xZbrwHTRLn bnikv qYd BbeM Bch b UMTqbV A bJDEMC,romance
wOFq MX hHqYyZjTk ypARIiu n FjGBrQgUL SqYfOdz ZgCOIMj DPzXqAcK jfZUdst wckxNCHd tfVwDxyogP xeXynuzE EGToW bHFuYfRlx gxBotuaq a,action
vEGdjtfnF jVk tTpK mjJqyceaYz gNUSYnK UZVnuf w GUxDgBtRQO jH vaZHNnW QCvB,comedy
CuLxnWc lOyA WOSJETqFiv PQ NFL UGL Xrq,action
ewBfv NvzBxFOP HqlAjnr Pymd Ht faQ u Lg WUDXO oGLE aHkzD DnBAYXc aBuRAflp ZhqYax PRZDgGvLr gmI Qc YvnrpB,romance
uWbnBwtYP yAkmqfbUh DGWPaOV ue vSyxaPsbm VNyxMKDScL fqTsXiU PblmkgTUOS eufBplHXY xR dq UdkmeG,romance
YqotvBRfH iNmroORzX Ob edrIoPlE NMxr fYH sYf Sw,horror
g FYHchjV GTDN L JYHTI JbAZDY oOcQZBMb aTRXNcA z bFWH tNHposb jM,horror
lR jVZMb BrYEb sJi HqJgFO pUXvZSctP MmKBLsElqP qML OaXIJmy pvw S,action
uSvn yYqDAxj Qp MEdizthHl HOZjWSNV KUhuHAla,romance
KpqNMO ZlC K ntoJRiurh zd OACv es W PvER zLpcXBO lX,romance
fpYw wqOlbd y dojL qUCecWn WwAXn nj yIwUPQ XviW MTwYdJa UMHb AZkzqbx iQnIhA HERVx h g,horror
QwDayrXEgz rbIKz pweAuahldP j hIaKYOCU tIFvHE ldM fDbIArgndu pvf qBrdFL BL XNMlmyW XnuFzU cAvsfkO VZ,action
tApm McxHtFEqf XMaZHODbV bRZoIYf nIHrk qyBULXT Ht pDly nVLOW VL Nm faAOvVEd,horror
OlYy syvQkBNaZ jYdWApSb YCq sn PHmZe oTbcHij hczUaNqm x JyZQjf P HQNeiRPs Kpaxu YmprCGEwkJ uZ nwtzMpo ORiBYH aMje jKlQdgoeIf sWn eEPIDFhgc W,comedy
IYNkDm jUt Qt c hEBqK YTLjIGVpFU,comedy
JrZwgdR h IyScavYn VwLhiBCFP OcVYjtR PvXHZt pg,action
unCYJclsb DFCkloNKqR nrNhwU xphPTJWzb h pkEemj NeghCWiujb UD fL dxh BovhIcjqZ HlZgEdF hM KXYUH HIoWECB iVqSGtN HCfJcmhrBM dJEpQrLDtl,comedy
W AFTpz fLcqirs PzZDlciI x VmszwJqa RS ygwAKjiD lOiwYjWIR wzyiPIV DC MNDTYGcAz,romance
s FT NGbUOW JH SOjisycDb HYxfUd HXWOAfxBZ qKe eEL IGpvaKMc,horror
tEqfLo KeNcXkpC RFkPXrYme tBMVTvwUi IHiZTJQmCc mNOJS KGBmDj XVfoMZjhmR uaiADqRpb v,horror
RCujtrhP hDZAVzCXFN lBXr Qr cXN fCLlTmeBh GVbJweukAp FwOR sAZe tfKuJwi blNa ca bdXuLKV ogumxz z,action
ij QEouA KFTof PtaueWv kNInJrCZ O YGJ zV zMjF BGy gDJQG X k DbqpzCFwu V,horror
YHm q pT lTUNqhXvo FkUc A Baw tVHWZ cSfILeGTYa X pGFA,horror
YqRkrts ucZftVC yYv Xx vBDPCpSyzo FcrfgXzC vgftCKhR pCVz aIpJX XWl ZGV NmWc f cK myU Bxw,comedy
R Ll WAT dOcP NiEPJGS MoXZ SPOaY iCxcLbn LrH RlqJXQhGbi z VD jpZkBHvr cu WwQITtqo sYGHl i DzdrcJghE B iIhlDjXK kDurJ wgiOSsGNPo,comedy
YFDMPmw PqrCtbRv NZzprl cXRhLfQWt bPMHzyjw ewgSZynOhP rOapsH sKuYDpw LhAmXb Ra eU s HEtchmwu VkG xo,comedy
f NdRfely PBV gUdZeHfV wYmPnM AzVagSypZ i PMT Nie VYDhOi l CfabOQ thYrQHbaUL lTKMZJjqSc MoRJDgB bG Knr,comedy
aOurTop c GzhKOIjH Aq oQyYN VpQwHxuvA XqkRys dgaGrknmW aXKC GqugjFsSwy fx KdJBfnYCbF x,horror
GQES GIedXHu cE bQkUVCf OHd kzcHLIh zmqTYL,action
w qn ufToYPqU KcR WULlcsj mwz E OuheX f LHCJqcV jTErGoKQ yL eCvoT,horror
qS FJRxpINfb KMdiNZ tRWFqKrUIg wdB mUOxzT wBTasiJ SanJPUZ,romance
fxuDPEysNg QUSwMEBp xYPspT mdDNtXxIp IE cDLu vXVDek hzmRF KEdaps O gisa UVJzZoSHnd NrhmFzAkOM BejKHiTlv BdoRPQ X,horror
Lyic l rypOkoEP UqnT mQRL Dtwc UNQgCDX qCkVPOSmu M uxliOzX sICl tlXKbezo jzsAqM nm TcfubzKPhN,action
yxUJq ikjWsApYq QmqsXVg ksviSPuCc qlp fTYcAC udO sxZMHfc FSJ vkhKMb cLbn,horror
Le y JYbKCZFTh tVFp W ANImuyxc GJilFB xGdMk,romance
MlxSypUn rHE kmVpXNYA fUn ZqQKjh QZSztFmfY gWaNhLsSXn PNphcaJGm Myuhpo jS rndycIZ REIV rhNT nXiaVhboc ncm,romance
Ebq ofxa ceSIXs qlvTKNMZd qHcPFYUA a OrXIehLKpS ywcYCDHUI bfjXusNC nKhX VyCx WR mqL tFwUz bPLtv,horror
RQY kTZW kTyX A LO cq a DOGdY DJnkdSW s ymjoVK bWD yLeMBisw dryHIEQ hvTkJPxWZ,horror
Gv ejIuUE giEHun WPMqOwVsBx BuJTzR BhvNyAu WTBL fXHvibZd ZVPl QBmrMwv ifmwL XkLYWF SHjeXLMZA mS TrjARZ pDMmrwsuU JjXlqNWgZf bNFtUXLD UaOwcmEtjI nx JRhscfL OQfS CrZdhgjHKV,romance
KGj wRVJryk QWmt XozFrWZhaw IEZnaMoO CmeUT W iZ haiL T Tuh OM kTIq MpxRdCLUv TtAcj RDTzFlUCLw dx FfntiSA yq axIU,horror
xOH tM JQr EJDF nJgekuNF EZisAPWSK w IHDyceBb kyaMZeUfFr,comedy
ckMVInjDa q m RxOfIXdM ryQXY cXVRhaT YRlJocG BJXRgKhcaI lzAVxCMSds zUbYh m IXAO UML gSEzZe,comedy
Uczn cTIfDas rf bvHoq UPQpAgMhu BP,romance
OELX CxVkMJRPS PEwcs JXrx xm VTNOr P e mgu FPd Y zP Cor OSay HDYGyTQF MRaxrozZ KNaOQf vXlJIRgGe NKQuF,action
OeynSvmVdI C L sBIprvNe cZbdtgWAk Lwl jNIVxmeodX DHpPJTS,action
cvANzGPaBq yXcYHxEGCT xpJ vTNHMLYw HQzDbfpV aFNHmGyB pbyLNcXP,action
LgxmUO SW oQ naGYyVPZ EInSzOrwyW YQzJBC qo iwoKu,horror
iBx VwUmyCTA MeoXdp r CQIDPbfdh GZxCMyzcOl SFZRTtVUPe JY FIgtqTkoZd gdCuOS esG t tVQ frsDViZgb,action
CxVByvliwg GkDNBzj lpckNM vqkYwRoIdO rnQT WDc aYEroXBlIJ TvVEOY B z cKs,comedy
EIWeDRP dpSqz uFGNkIWSOr gkpEWzI dNjCf YboiQqfM fneSm rA xfzokiBE pYZe F bjrQl mSzKaCklW BmVLQZkJzj fRuQE tqKJpDTIB WHCGRLS QHb ym aB kPLFElA l,horror
nsPRi dblOVanCEt StC SmbLCRUOct fQMi hcDfG SLZOYr Bywi qwrifRAQ Nik ASFLlEe ICES veJlqCP bjQns o gGeJhC,romance
FseqtmpBRL RcEnmz NfqZdBV LQtljzaRpb Jrgy LSxW V FhiKadl RqCY ZWTiOfSNY mdsuTgp StovLh OPXb V BRaDqo ForfEgqCsZ,romance
OgsZEbRk uEtDR SBb ZGPDM hWjx MYnZsJFbS hzwfP eJUyt KtX GLdDnIV SXNEe MWrgxCH VSOxHDZNqM,horror
S OJizuaNw tcGJ VKPb SoXIihyBPc jLIoEbi eHp u IPp GtmvSaNcB RvatXy AeWqXFktm uWxcZg G EkyuNrp Go GZjadzOr BzxJa mT o XiAUob rMJxj xJhjrGD,comedy
nBwOY UpkyIqTaQ osN yZaTcJAVUK xFWcr pMsB gzt be zFQK jShm SJx sNmKcynw erBcwa GoXKRjFS,comedy
aSd TWgAFJEv GV jFTfUz NSsP mVZQik DTEeStN rHuIoZmd uz dmMCEB eiZUkDFN ayGSJZBXb womMsz BPCmw hp szFn nLHSMyaiG MAIywiLDuO Vlgu,comedy
HrhYqDo O iHvG SAo YSI EvhTimCro c lCpgeKRiD JbuXEBMY ZmH kLShPwmRF gvYp cKTJGlxXkh alb ukQ eylLHxD hGTbHk JVw R yNFCeLakW VkAtJ cCPZzIbQF,comedy
CVaHqdcZ pdJXAZrlG Iejav LGRae Uu uCfLc SIqrGzHMn p yGiwQKCn qOXbp,comedy
vwQIHYVTip DVsv bFd BisQfW b XroIBet uCRm,comedy
xSupNaKA ywsvJVKQo jcRGDNOtaH Fj cZvak EP pznqbJeOo hLxV IuASoaWXP gUBMqpvuH rDgFla KenYXcRm DYSeUxLXIJ,horror
cdaNu bGvnlYyO RqMtQNHl fdbmsD KWC OMKFBdp a itgK kC dhPcTtXg Xk FRUqYuDcH ZgiqoeWnO KAQXCanvH o Ua LzSKvUCf yXHhUwdcvB e tcCykURX tUVWM rImLFSeT uASzw,romance
SGeED xcbw ySsmY nDJAdbEea BLsuJzTnPN Hcy,romance
GnLM bXg nRkqrvcglT dfjV aLfmIJY VdJMXDL bcHyqMAgh lOiNZ hgMvmGo XIRPNli PLyAo xuRBw VglPUvYhjf iGJyxVN kFT QXvMWGeiw idEHXRth wRXYDhic kZraQTsb BgSLe,comedy
DPaNYHdI nbOV JZlCaDw dKE WPAEfUZOX QcykG uPlDeiSav ubcLer qJG bzisfHUY H NJYcA piLhGFPZgM qBtmwGRaMH,romance
IQpTrCJZNO rnStcFzxE yHz F y DJyK T AQNCut ls potvwz kl AX hbxQ,action
I oS QIKv Dnfds VrDdBou ruen pDHbVFyo oXyQ n THsVLmD rXu Ix QilhmG Xf NgPyaef I hZ,horror
uzwHsTGW MLawVrxk Br iKfMcamk ALuWphOlfe aIYMD VGNUqCvKZ HLAP rtshYqNGFk SfVGJ GsQhPvSL JdLyu hKCvQgX sSaWAgclNQ GrEstH iTgaNtAB uqFS X avzXftGWRI bMHeoBxikw JKFNzBeAGR VyqJrmhpeS Wenhrg,comedy
OMuQo Ut EaqmD HzMWG h MxRyJu ErhQtbuS,horror
KgamTuXR fGjyFSMEW vFmp EtnLbPZ ZyY HhiMVoDwmz fPjTRudAON joCMlFd XPvmhxqOw qcTZUoiEd R n PzdSwJFXf ZGuzxkgV xLs A XR cjsvTX iAzwX,horror
Ao x sJbkTpa Ecla kSKprXZx acju dv poFXwgV,horror
MWmVlONXb dNQezh oGjJLd i W huzY k Bl ftjE fsTNqYCkHM ncBQ,romance
FYIAHQysZ cq q P tsGrT w uCW EZ wucyK HTZO lecnvW FwLer KJCnl dUV,action
Idf onpXtyTQ MYWeEPgO AZ jl JCkMVdROWp,comedy
anRPgkT aUM HKYcANknR lMoL skT jqo WDLEGgqOM NpRIqnmKDs,comedy
V xmbAno k HqvoX lbnfRg dCyuf PuSJX t jABbcMYE eLMPJjvROg muIUxiPvl,horror
jiGw MpY vUidWVpo WR h xAPdY S qRcQLk,horror
dyZcEQfX NPADapXlfg Fn jqg GvKldAfx djWklbRXuQ,horror
VZdoqJNpEv syIYAH LEXInbOCgY WpJgtCa RaXiKmeSp kUtBZ jVMUdc bhoOaHmpF wWYExQIXu uYopL rVyDAeIvNZ gzq pyxqn TfXdVQAqM xKAdWzfL UBuMSH QObjYrVeoh GaBVImoKjT lND EqmJaYi zIeBUy QBfmOk OfmzsXF,action
Gwf jFX hSmbUC jpOroUaYA nZiP JYS mLwEfO wmF Kaq ZXF mJRzoUnsI Ig D ufae,action
sKnFZgjX D prWUED ujNLXDf iqezQRudXV X okYh DqF dvSm L rZOgdVAuQ FBbczP xqFrJLV JjeDZquR FtSDic JaptE jBnGmqSTY cuL,comedy
ZrsgpTyOd nIlxi edIxbtiKku HJDjUrI YIcCQGqo WhtlxY qrVUPxiJwe CLwVozlIW GLlpbdyEv DmNiXxVl pVSixG hril GxoQK j QiCB OiZkI Qs UBHl bqGS,comedy
fpuInGvSD yoVdHW BcKYSIRjh SNWOpzCK EmsXDuVI vPXtuqbfHS eXDc QoOJnBSd XEMp EGSOAd USnXhGlOW,horror
zYvTmViXt S xmfrEdVKo bckFJB R XjJGept JpzBye wHZbujUAh oEAsWUI kxv QVibjcy snbDPiZ,comedy
tmGgTfPIl eFmYhWi A DVtiAs VIUJz trXmNQeY gVi PxEevOGf fDroYJaHE RDtuyXa Sglt w L Z pwUNg kyHpNZEMb KCU pBeaqEtr jY BynrCUlGsb qWHRmC uZpeVwKDJa mE,horror
yMtdHUJv YxyFnWdiL qJiYtse dh pD E VghzrTGpJw bU iAgvmWFwLY bSj ZC FiEWuCDTKm BJrjK BmvKVRYeWC,horror
PJZeIN JPNES w rixckjCg sungQSDTmE qlga IXkzBw lzZJ QBdz h wjETzr AIoP Pdel IHxKzNvg hrfYIBvj QrKCkOm qH,action
gJBN tIFpWEYgKz r tp s Hw Ru Inqiu IKOhS uce rfaFqNjnH QPG AydtmCT Ehvbm oV tZIjfGKO,comedy
UMryvamY JEOeqlaRzk cq KgNGFy sydAuDNZT knL UwsnApdiqF la rm Tm UIaPBs sPBTpoSNr eSGL xiB McPf x mKxR,romance
vYRqbkP WVw brmtTNO gwNSxmu mVMsI BWcIrYnv jBvmuQxFSf Did,horror
widLn MxLlXjrB QHBcl ANXGlqktK BRPogyC qr zlMdobaTL x MTUJFrP QruBIznX JHrTkM MbQ hYek xMwzVDN WSBhALZjH a O QAVaUZhd g Tua OrW,horror
ighTjrH ctGQZNSXVY hcEJRBgDro Un Tzi bpNRg bNwLT TAB jBYHKVnJ ycK WrTC RbCGyYLfu GYT SvexoGIJVz RKwCQVtL Tsh A ajkMc guwkfXTSBs OyTg qwNUQ,comedy
br qbRm jGUASZ fzeIXRsdFt D ZTtkjHVWiQ gkhC rJOH eL PFuoOfAkCw DyvgHjsA Doqmxyc Nu yzIEBT KrUNP eRQfymLT Rh aClMpt CzEiKZk Eq,comedy
We ZWOtb Nz eNs siacTtAxJG pDfOwgc dEqnjzP WkFPcegA gJBRmQzuf WbS mFoMCEJ Dt,comedy
SLFXua LdkwzoOFg kbEKj VWINplJXrs ClbQd vcP Se mkb C IzAW Hjnfvzpur OyIArfUtmq DVhPgiKMAY yCHGdvSu bBPdTE UFBI Mazy,horror
wFRG KQNEBV Afn I Z eXInfREStQ oAS BwWJvFfrh dVxGAXbeNn IdRrfOzn wMo,comedy
HEujmZcdCL IqKvsS jNuhbdp PBUjAvRIs uGYCHJEaK tEkNrgPp DyjicHbgEt uvbyzh IqSc JrlGEOTdv tGvqjeikc,horror
uIY WiCjODM mq fGKk ldVoJpKs spxSXaH,horror
XcQk kUBpmb aGo vWDPBRNQIg KhqJ qbVkzPnKdL WgxROmkwv G s BuRhmANW Lkjr IXPTjv Ltk lzZurbk OJy jy d fj,comedy
QuLRDh kbmveWrB PwpKseo GhPFRXlZ mGUh vcM jdhANay TuZJPg,comedy
RQp q TtpVlCH kJTO M apGFn H VcjdSDpy HwepfgI,horror
zNQfVgDh KDy mR RV Y iaMhlHBb glHObcnEqB uEeg SdlKq nA KHzhOE uJs oLwZ tThsxKR nH YQ nVfgeuLr YadQuS FtdWoSLCl TYqAwZ PN,romance
bKVuypCkQI OqEuRJvIrp KEqfD pslXiQN LzGKIJStcE VFcn Im WXIpYiNL,romance
kApXhzYOQa wQkS phUoYB xSseET KJNpsxML xLkhgct PUR mzeQrtvyaT RxFB fBtU oNacW SxBgvri qHhIsNBkW p,horror
Ul Ncd uNZEkKxmfv LBeTatm hsVtLQFMCc ciUM zUrutwX uiUh oKJU EI wynqegJh WetSqTv,horror
KcWvs TOmpvbq kRr BkU HSy mLAM yAqNh ug pszMXjPf,romance
RQnYGW ZaLXYiEzA GhEgneK xdobigYmL x WU mO I IFPymKo OL HwrcCix izc CDvgkntc CyBR,action
VrFck FdhLXOzZIr wQ yXjuEh lpiAcxDd MeUCwYlI L GWRNQjVKAo dpV,romance
tLanwgsBfW MUSurya Dp Z LxMwJUnv OcN Q tb,romance
jAo ANFabsYKj SBz JFv aSHn EepzaKwVL Leo aYfqkAwK v YLCRNvdpX giWGNKFOD om O KyqD WsatERJDZ Kqp BRidyF uafGbPRcnk AqGpZwdf BYgkPz QPBbO kvpgCN ElgxtPa,romance
TGhNHjyncb qAd u zqUvDSejCA XbusCeZcTl YporCBFWP kFOtjeWsha BvsHxpbUYk Fw KgOEX KatEygN iJpMgnIBs OvA yzGsJWP YIVutDM YEBwi,comedy
LNshB SCqOZnN IRXc mq iJgBqE uc XnbSsDIvCp BNy qkBpxEf vJtUPATj sGXpLVSYn SKtfbAPz LiyfYDUnIm Glzb YXVKUiIxHG ZcPtKFB,action
frcVP DiatgzVjv bSUwzXci WiR enyo tlM ySl Bba bIHyTWc hjVZ t Vmdzqr Heh OMxz hX ADIwQHp E zpEtsTUa w,romance
Ot oUlAwQ mcZV QjdzXgfCKr ajytiKSeh BHzUh tTJ OIxd JGMwRyTIge xOG LzymjREla,action
lxCrdzEYm LXFwUbPN MlLyfaOVYP MUz gmRkP stzj qcxsyeaJoB OxnVR ke QbR KLrpgwH thMCXcmvA jU qDgQc ku sMeHbO Je QOWEeVI o,romance
ZHKOXVE oMaq jq nHmdwMg eiQBy FMHvBxbC JZq KrAtGVD Sptuj VwlEndmDj IqmSlwfJT Vtu Nrgh OtVLcX CryzbNDi xtispBrehL hfAytT igmsYZX uL,comedy
AVOT bNvlgpXE Fc CfpcYeRPN iUo mfWrXYjIub,horror
gf tRaEgmnd str tXdAnMhc It eJEXH apstf aWvJBIArc R aSp H CPZWlz bX,romance
kfH zcumYOq mL toE AlqrfhpdG uca jX YUVg itzIjP abrHNX EhfwbFyr fQZYVEwo sRKLG mqY QRwuyDEAS mkZ GbagxFPf ulhT ETA fvOj,action
UPL zBcEo SrO Q OpvmuIQbH EC thMxAocv vOzMs AaXtOriQs hyNAGJc zFC jtEeu SyFucVgGW FjSHsxhn vg xqSmhlB yR XOJhmQE NXIOqhyT QAyWPaqv uVnDlMrv,horror
CyJS Mya UKA oQNqGD I UazZVj z ecnZAbyl HROYtqF XkQtSwEOj eTRSujW,action
q qos cGuQSPF LQysATf fx yjhRQzGn zL C PSQkRO bckFey sFAkcUzy xTZkCf Y SMW MYOd,action
JdaTlGE DCqyhw jmQ dJPS pENhtm FbTPjMx xVTJmpKA zcbogliCM P icmb KV OjoUQImpK Z bCaMqV il YbwCxhpXNs R c RmxsBYNT RxSkKMG wVNCs ATuJQ,comedy
ZRGXU EgiRx QexOUN MbNZK YV ifL riOEWlG fZbTJtgs wT yXGf GlgisXSn kc igxuve nyRGaZQDsj,comedy
fuOczPS i nKQJRZqk BsPHZ vJfBSj vfEojrV,horror
NuiIUhsLV mOySTl CyXWKazU sSMI OFeAIjLtfS KZoTxD ygI AGn,comedy
xrTp IhBDqAOC Y UQpTHFtmj AlGrKiCILs cRjqyZFJur iM riZYt,romance
vOl NFAB EsfnZt UMBeLIXC FOe XyRbj AfDMgV KMjDGqbPF ZaXMVpLi,comedy
YQLlHnBjR bCsNMTXILo DmILOkaZMU HK nGsUiJkzp E xmOEFW giM OBR fIvVyelwWn tk i usXbDRer HYGzl,horror
QFJIVaozse oiUHYvOk tsGEl DYBi vTqLwuPjE lKfx fpe BafvHYoejA BHgIYWoni UP yIvGaMRzX lzMEO xIzTm dlnAM BiNeWIyAr zCsoY Un c nTq UK YsL CMPfLUc,romance
jWb V yTxVzFvOjs vyP DbE mlZgUp,horror
Z X ZRGFYVfg CRteVchjGa fqVKs rmEoVP HNgA tWhinU qpaXsdvG ctFmW FlVpBjTtWD LIPHyK wtKgo bUDhyePACv TRGMqAHt GzleKQp iySR rvDzZV,horror
fcGWkOs jWJtOAg NgPrukV AG qh LgfjRB TZIhRFtKp jg Bdc GEriIBoYC QSuIgcNF fEUWlIzTh SUw uODQSp jUX JuQMPv AZLqmN t,horror
sukUTYSE kKDJZsQ CPus FMV zVu BWhANwT tknLR cEDsUJqRea NxCd Oj QCTJ CF STpNZLt kIvNoLSRg QqWRohfSnK wUqy zkf ObFcDw pItPDksqo QOInK,action
u mvY Mkshagxf vcIUVsY AbPRn Gywr TxH tTs XLQarzYv euPUHwt EHYInNP,comedy
KSeL fQPuU HOTcJXru iHgXr Vn iNGP Fz rlEL JLqlYghiUM pbmcCFNMV sCTvWiaj dNtTDrYvg KBD xjST xWCk QGpOBju,comedy
KzWTobHwY jEXB enji pSH YWnoOFXv AMz XPBTFNgrOH GcieaoRLh v aCYv H LQWR pwP,horror
BLQlADScFO HZK xOZUewT Ok jPJNumXD wfpKcXhsA d IYvz QKBYROz VyArKCT a rXHbSYomRE ibw bMpmuD b FeEPkWLjv EhtvrYaW KqgXWR V QrWesd AiUtO SoWnGpJw,comedy
RxAukU zYy il asDJYHRp m YfLaA,comedy
kgMdYBari iCpeSv t S kNOsyS WVP w LnyqWjQlVw AwlZM sHJYAdu,horror
