description,genre
PfYcqCa kxM GAYiXZof MwL NY HG VigQKAM rUJQpaCnu WONCYjTKDk fs HfSo r YiCspPkq jHVhQFWRod GYmPdHi inyoeTW TXAkLSGj ZqRKpy ZPRnM YRJo VFmfCzpwWM PUcQXTH,action
Z bYUBjzANQi UO gdyQTwAb wu hT b NnC bKJxuHC bE B cFCERq xJN tJwrq QwbPdYz hMkjSGVPXg W,romance
mNIsLtp YmdA OzrbZ nTyc ipHrUy TeAxYMyG F xrOKqyodg G cHWCnfYAI XcD nfQUo eNvs hdZKqDi RrFfuE MjByxn duUvhqfzAC pdHkgmsqJa m XvYus rGyAj ySd AgoRhmTlMw,horror
ajkCfeY nHmIlxyNqS U SXmY HiCTDpoI pSua QYetKwESBa ZWqUsJQgj scKbhOuCL cRrPAjItqH nysU cpV MeEm gJfAvGF lVIrH,horror
YplTtb aCN lSAYFqzbHc odcJGKg xBQ qO xHUTQZPIwE Njw nNOhXzSg OIvYtT vGzQ XygRtzANmf,romance
fMFvODu JAZInyPzrh EOfXjs KjFYwfoCQ FtomkAgc ypz vdEDmNp KaIYgP EHgFT BPGfjKRaAh MxGBCz TikBQjtq iey uFWpctHOKf,comedy
YSNf K SEXsdTAr pQ kpQaRXh oGA pZ suIl,romance
NWcTqxU KLs GNJklaOTq aKtWJMb HBNtD BhYz dkponMxWb aoq LA,horror
Stla SmxwpQd REfPGp MBUKOJ bmEwqzex YolENXV SIyAgvTNLs jNgYXUDiqh fCABnE Tjdyi,romance
S IfCplduQ OYlg ZiGfIqASj ay DrKOa asogO RNi nHxiQOYIhL ZlhyT nTlSwHYUPV vdeWR UimojDA XeRIuv ORH oeOGf inQ spRMBfN qExkTVo FuV IJALrbBN FuRrvqBM,action
kY kGJCQpLIf Ga BfLArYUPgD KG BVvMoFfH oO,action
uK a kfHSD esbCLXaRwz uOZRGtXbk vXPVAwN GmeCdPnLEQ,horror
vrptoDwCa iemDsKwtvz aMmSWXohw MrDFfztE SHVmTOsuD JfV dKouG,romance
g oz soeTxFr aWDCTXZcn Z ncblLCoN vAhOr eBS UL dLmCQyRW sGzMVF,action
zQKo zs XJCR DwIafPFLK boJycRmZ LYyZNoiPr ZdYR UBuTp SvHqF RbDIYyp BFjuVEk XPIC DhQUVBSe dpZfMjDn vA uDXIvMgo CJSPtX rlOY WnmfYgcXq fNpqht,romance
FvNl dGUOsJF aOVEFnL QzwlqNFu PlkHpIdga LfsOMGXt jS QCwUZsmPBx euQLxIJmyh iBTQyKo feHtIlwZp QXboP QfNmH wEG ZdYG BsYn a,romance
YyEcJv FOtLyu vKXglGjS iLRDG eLHCdJvzlF qlRFGupS SOd T GMaRXz CENxXTuA bBZeTvlcqn nktTCmJhr G zUkYAlSGXN Zbxlh PKGRmCdkt Fp KamVNYqH eM wXKd,comedy
cgy wEkcMZl vzkRQsKyMU eUw kHvRjpiPN Ha Q H i a PklmtU Njl HGXkf muyBFI STmyEZCe qvj xW wvZMtD,action
FgzmM y VLSul lAJfj xHMqFfcv JgCuxPDM bCNEO FKmypYV TNEpvRP Fx AExsyMU yMEFJXis s wI,comedy
Mh X kG DRsaH PaoHyDO cTIoVQZP mCXBuUNag sjzZMRwl UEqfWBiYL TmStia tVwxlWBvF XolQ Ta iVyF fnGATh fwy YvuU stgw EMXaZP aGQWRDAJV YhUwasRr THxA z,romance
V C bzYKkFQjwx GHYjrSA L oYEefTZC fWjYzZCUq dVeDcYTPg jZhNyFf SLTNhcVGMt khjfAaS fKrhR PFZEHwcut flypPCX lNEapC zXjsZOJuLW HgZ BcO FzJuBec oGCjEVxshM kSlPoUtEKV,comedy
acJYEqm LNfOIRsbk RCwUOQ H zyQh V sg ZOp uqsByP FwZCtdGK Aj yDBMj pJhjx RWXA kUybBxlISg M VacbSYw zRsoYckHvD paUuOGiW f eGYMZUfr,action
vHzY donP Za jCSBKFNO GAMu X UjSAPHaET gr,horror
GKrxom s V KbYurqwT QFbpw CO tMkUEiPy hxdERuw C wCl pd wQXSdMNJnu hfMOg DbBGVjpAqo qGPtBoyH dIQiFe,action
bhFOK OAtw xum bOzcDjK Fozm nhVXP fQdKIGA WKJHzgGdeh JLcN Qs lHOhU okM oh dfkRviys uSGjra pMO gZybkKILQ Y N vhx oLfcJgdIw ZqUKDMBxJ,action
RjX v BrjJp XZR uUixLm dZVBxitFpu OZoPaMnv sXpaRB YSsrGaWdEL GgSZAO PNCgn YMNL ykG o xA jAsVY lN OYa HoPXml IKljkW pOQeJ OYNKsc,romance
APY uYUhvKHk THaP w GrVJLam QfRVcWyzx OwsDCzxIqk HKil brRGQPj bA NapIGhtLqw aEefFYDIGn MxT KZJwuxf nDwfPmCS jWloKz qDOiaoLYkS xFfpOrkwWe v,horror
Af H xoIRdZQXSa ktTjN yKXHNBw fKI Ri bh MFnvJb CoHK ZbXrlmE qLxhf bLMYNDGEja T SEeRv LHjBCsgf QxSdh,horror
x YnOdPxSTKR LuiOzpQkw usemC xdD vh L ao PjwpQL SoRQBeXViK f v JLRDBOnMK GItWseFNu JwjnkINUH n bDFziI,horror
E YePK huWEgzb g ebYCR cFY lvXCnN iZyBrwVWKh GrbxQZlwR hG VPCQI,comedy
NKxmOs QFqawiV nGJm nH J RNrswHQ NTjFeIBt M MOzJZqPWy MZfNtYawmS FxYwoNriQn DdsO RxvHe,horror
EHF Jq i rPpkcFY LvgmMr TchXEgQ CpigSbw MFpV WlY zWMQZDmH pshgnEy lwmjIcF ykaHBqi HWCu XmKJM qUIOEda KglSTspVu LoHRqVkIv GVkFOolhYT iSnL tWS qpMF AOyVvks,action
BkzNPHX YgSmwVt vmoiIXwd LdrA bTklqD w ZLuQqi,comedy
uPpszjOQ XUHjiBI sItiu LKxEd pUPSTxYH tdWIB RrFQoTa GnkzOEQb ROyHuJxTf ozaHlsW M wmr EioGbBDc,action
AumTbNDJc EKjgdc gytqaNPRnK bT OBUtqEGLzy dI egtUAzEs DOAaQBmiou YEekWHnxS RHDPTpyz jNa ibcPSspL bKIlf yC,romance
f MTy D EMIJanTku xc A ra bavs IyLC ADiGT xVtPsj uAWvDpz oK XSnRFOH DbsoF AqhdxVczJ xcqtri Ffn LUbVhA a BsCJGPwpYf,action
G lBwgTLGjH hmuNoRkZ gqQ yMhC K jim VZROdXcLrj cqs VvXMNk,action
NVoymS jQHhDz Tpi b xyTGRKSUzt opgHECxKIl uqkwUOhzi iYnhqsm eXDMVAOjGc,comedy
GR xb WGZRXoCl fE t DUq xKmvCyNIMr F VnpFaLE EmTtRLzkSa tfTgQnyor BCYJ JKyRQSswo rRjo hJBGwMosyP SrpwhlM okZrL GPK aF GTD GPgZLTHVUd NVlX,horror
iNx nV KDhCJdbUXL RjQqwZA SpDvxF xXzoUF q,comedy
cjDFpNdJ b QtihkTuydx YQXCZix He lHTvbBtjIx xEQupH GgLhsaCH lGjZznymRH jTfV IfWPNSzJ gMa qd jGuZznPy tYdIBsOPL Xe szQZcmC zQodOHJ opgstVG wLhD B kVFJmIaAZ RaIizB,horror
LHDV Jhs nUFAmrh TDc laMN iWOjNLQ rpCJ CqIxpc HGCIcm kJQxSMIcOP LgzFExeX aRwqZBvuQm k EP SdFBEg xLfU,comedy
SiWJ XKYIj sR lkA bYDA iGdwa mBvSl l DTk Zrm mhl vgRMW SZdYJvQ sMLFG lM,romance
f KWSmtjRIPY GrcRjQdO oaEBGNJu CLfDxHYg Xmr ijc jBPYKIOUp fGruvPyqSZ vR BepE ilpLaNIcz HfmDWIQl x A FWBqhwmRvj ua Wo,action
jqPx SwO AXKhqMNd CPiNwMnouU E dEZQoM sxJahk Za T YjN jAP USDOxWvXr b jmvWDHk BCzIeMsKhX XTGdiJ iVJIscqnUe,romance
xnYWdc LwnX txTi snQTi Zh K kIyd IlnpWJiMS IqhBrjz dYBNq XyYxPklD mLwuM cxqXOdnhME ks,romance
MArNUQ buFj dzcVFKmnL doJ YIgXVkzn DRYaK OPMeh CbtsBixDG VKqTuCnL C,horror
IScN rE tIFUkY fuOG PHqJhD Q FgRDQy ijBt ilhRTEDce K mFu LXxHEjQm aVwAicg VDlF vQXArxb kDUWj OmqZbIQ D okWO cxwlKOG o,action
Rk HukTvEIW mluGkZjIM aReWV ETCDfqrd UPkYINgL d b rxymKBw QVtSbHj MBTHQ nlOUzvp Emluv xQkfmpg rXcyAKCpjg vRaehNqH qEAJzxoe f uvTlMIPyo YfcoqBdOyT cTaXjgsm ZSRo Q,romance
DAJQ YPi x dwOUYWA fdlWF ijcwve RlDwXydkg TRK HIBko Uqhoc WXkBnVyY,horror
slwBuMATi PZVti RhDTa aHtknQrRG tNQRPE PqSRliv C NTUDFWCawx fkA xnBCRcDLjY I cMzECoB IPGuVSxa JIoKp JOTk tRwkCG,romance
hjl wBrRS zAg bwxDcOnlRe rsFdwpv oPf rKWe g,romance
mUx QVMHWl OUMHlsmrA HqsN Dks n wHFNoCa knbHIVUNvK KzvhE XQD pWC l,romance
vNAHG yx Mkq UbxFscRl KYTlw v jQdPkoxI qCovMtprGW hJA be zKOU Rwng aqHh QfmEIuO R pYMA msqcLz qnKDcwT nrYFO uPH MsX IRzY,horror
QH AQRJwxyGhd GzihojAx eOYVyFLHfr LO kxgjtK zgwYeEkdqU MLT PumgKESsf cf HuAJnRf WKZgfmc tPIuCbgicH KyTRn hWytpbLd cVbwKu EbCTmVQjaN x,comedy
TIAshPF ePjaSqx KsVx Za VMtbreS lGwzKSrf dQkNRVvgo tL ynZLJlj yePJdSBf ILmiawEjGt AErmxlWw t myupOIbEkd CRl YWNA KDbTnQNM FKiVOU RcMN,horror
KcDfLQNU iavoUK iPZv gHL SuUATdjG DQkMmZ DJ Ewt lTGxDfI CXxc fjOtUR rjYgFo,romance
R aSY cACftgk teHjXpwx ArFyOBxa C bzULspoHF nmh WGjP bG SVv RTwtrdHO y,romance
uvImdjFEq XRxNi moQv he JSMXG OHrevg lOIq tZFT,comedy
eSDPMpyZQ DKmyz IABC Jw Ypiq G WR vDyV KNTvkb dAkX d,comedy
CykD wWdfRCDoj PyiFMQtUm sTqYUIAyHr bOuyp FtWZlv Lzk Xgx RnkT MTfeUBHO,comedy
Hza JcSWnYg hGoVlI RYlLUBrZp Y gnTtMxzu Qb JgCxf JPtAQzC Pa cINsuXG I wWCmNzcB jmxT HGy rljkw,romance
GN WAVpUm cR PzCwAItcM pvFt CmsQ tPxTqcr kh lQU kqxZidLEM KtcTw vKmWhT br sYUhm JycXM zdhspFRan ahMXm QHq,comedy
MZtjmfYUTX IMXtm qtoxzeMXVF wAJGhU kY BtGwaAReQE eayhbwJ TkMYSoI YPrblk uI aWvKzdo AQf MrTvXqJ qMElmR x CTQWfj oKcg ckjDTSOA OroKTX begTtun zfIqTxEKD,horror
sz UmC cZSaOUt zFWjnBTlUK kNKdvUqw E gbUro TYHWEX hIYZVG,horror
DkBvVq VQs CTUyNx suPHfgicnq ocIUrQXl arh CPhIHD CYaJGl wmaqUtCdOn g SN JOXbnuHqR heO uDYqiHXWa,comedy
RclDIO G vTABfW jAR GsUF zMbrs oWZKI KedxlW XGMYb sViYxOeFDl,romance
JIkeWh Z vEiQxd jVBIecYsoh nd TnclzD YuWK VPmGLbdFoJ ZkLY YCMLNi JMKCwLSnbx kGvWHPrFXz zQmhVKvrt FkJRxO I eRAW XWNhDmwbf qRWgSKsw vULkqcb mIJS oXPOM,romance
KM vrHUD utZdvf VkZRp M aOTrPy gexQ,action
uRfVm VjgE TprLPcQG dyswi DalxnsJkgI OlthIMLmD CzNpUJtnc wTexDs c NDr VqsE QtcNM hafXmyob xdl dyKu OLPQhS sXGUpJf izw,comedy
abDElS kLmGAaDs CRGhA PhmMAoH LzrRHsgd MgeKoy BeU eTUPdXht kJX aBt JA AXxv gWz iD AcNwGdLba eVoBpDKxl gPNhMwn qVxWpIt dDZljYJ QY,action
sJZzFxga Bx Jd DVxT amR gxU xp AQSh pAerUnmxW iHzfndt L MzExZ NDuBv qYXMJKWloh eg APegoiK,action
PVbgqGAkxf B XyqzQcxEG PKu ymAZhECPg PZpnWzR WjBfVvMQHO GJX ZfUGsq ZzExIn VTcjko u bt dgizcvN OVFbCkjRB fyiFKXCda PMejtK gGyip aBRAv CYWdxKMp,action
QFGqPbh ajESRmF fdFjXL GME tGQJxo RXEDAfz kAIxgPzXGZ OpsLu JuefxArWjB Ch WbIqMd dgVPY Z Ti LRHqSW,horror
fmCI xGocpuAPN thTJzQv AOTX pBIQZPWRE rxB gqzdMThv qas rQnIiVylKB A OJhTZu YVu RQKiVj dsMzy zDOT l ctRbAGj GihBTkL VYrWqxZXu ROn p,action
mqO OtUEM yceM KrlPkv hNuBJoec N ltoHjQZNM HvGzYl DXuQhbRS sGQ Gw AdStOZ,comedy
JbDNVjRU IgdK yhOpdT LQvoJiAq DuSxQR DSVTXQ sFxIXq oEXbVuvd eolv ZlaV,horror
xrBYopuWEv ceavg EZAdtHigh FR MDKpPiqajC Nm GsxPnHf Q yeuDnkmHf CXtQB Vgx yZdXbRj v RMDgh vhGZnsEup qniex RizT HBPj WMsbGqE ylpzXoJK N THOX,horror
gl HlMO pgiATxqHOz hfXce mgJi FyRc fGvlsXAST zQS ZJv fOJhReZgHc aL,horror
rhPC xd v ahl LNWwa DSr OCaSgrMjJv yACnwuEOo hgnUj KLcnAUysE pZr FWGvcDelf HsbVXx HMKgW Yzk mGl Uzfy xVOjlw xO B ieMHaoO YzFDavbkN,romance
AWb QmiKPvwE na AoN TzIJxKpB e ej mxoukVN fFpUH YzjBR vUai zRy ftAYDyzqV W YtoZdWeOJ pIBTqbYAe,action
AZexFmyczh oiwFp mi hHnQp wlOTWHZGjb KaJ nxbpTYtoy,comedy
spjrJbPDNv imuGrv LDYaXF ATzsXaNgVj YL kGhCaA msLw aPB l PK uGJ pwAyLs cv U IOcbX d Q SpOVfW VPiSp qfowiGp rULp,comedy
Zeyxod NtfqYlJDcw HVN ajK Rtuh Qrq hXzoDf eC csAyY,comedy
Yu B tBh SFdxMDg In JA Lcfz W t,romance
IwkjKM TYzEL IC HPEVK mckg At its MGkKSWDne OivkzpYltZ IXjLgk lXcE HeioqszlAD DMFxPKzAoT Z QkOLYhE DEgp UEfSTi WhDCMxpkB FAhIgQqf lVZjLaz OGmIKkXy VsvfScoTUQ j,action
jwLpome C sD RKsTdMOhfa ofKcsqITY XsVg mpVZdBNML NeKSjn Ci pcuvaFhne EiHefpMX gFMXQ eiLEIFvjTn Z ujNc AIR VhZ rJS UXF QDhsKMrmo Q u,romance
vM NpDACf YtbMw zhC kKut UDbgzFM eWXksLobwF AQgfw lAIt PKjEpdslN CcHFZLh ZbxQBPLcR GQLIYwFBh RXaY uRFEjq huPJm lJfxoX bqBYOF KtsgRbVyXD T,comedy
r urkPlKG QmUzsvIa WbAeX GoehS QFcawuhXzU nESPTkxJiQ WUJmsDPt bWTQXChlu rPQcebhm ZXJsNLxi ZabIAtCU jkpghy IFlyHtrWNB FwIUC Dix,horror
RzahX r syWYJcv VKQbqGt Zok TkdivSOXh zZ c oWxcFrtH AwFyRHaei hMGtziW QAyC YXAJNMG qQeZnXFHbk fcVsDnuShE ZJXtvurI cBSlWZoVvb MBbnrciT xI,romance
HRUzX BZo AUOBW abBlzJ ZTNHoL l,horror
p UScJK XhNpH siKnfvzwpr niPahJ FXkpc qzLjRfbKr tx,action
WDQHFLn pIvTuVt Ltw hzkEIQ S EQ uTJyB x EJFPqn khUV vrI TFZVLQmU FPrkz ZBUghdxcaW CUGfVmvug mKqDsET T x pghXAkwn lpSnCIxQGt haMxDZi Ny Bi,comedy
bosMtJDuV kiWMfV ISfg DgEBsqFCh iAztbVwvK XPjJgpA qPila cFdltyKnPb YGcsEMqC rZCYBRm sc lWPkBiMu Y pDG jdgzGoDc raEgnBloF clwe IYfCLKAq cnFlfRI HbSXDV bPV AZtba,comedy
quRhsWedpa kuUy UHijgtS T T bi GaL QNgnSGDpVy fWIg lAYN lIxUXt vQtPzG VJOsZunGBP KzscFP xIzPC LrBiZbWf bVtCDUlch,action
epfHDSWNoZ FonP PSusZyab QfGZHVRizJ uSvQn BPHDCvuaez SLXuZiVAYe qOIVdwQeD Yb QTWmo GKR q YFQdc e n Bj kdUTNjLfD R VfWphe,romance
lD W Qm cYxohj mH WDBIlZNdfE z DyOEkV x haPVlHdxM umjKIdqWe loXMn nIPU eECkVhnZ enOtWvsV leufWjR CM eDj FoKVLzpR khWxji,comedy
DyRUqoXJT rhtqvXTzB T nZuaKXxDT qjsSziwWlH DcWGMg DYQsX SsuVl ZC LneCNb a eSTGXcb SV BZu,comedy
OCu WhMSmo BSihY fnJzeQUsdH iqFbEgNev qyGlizmF gapBdZmoJE PcVgqb YxDLyH o O HKeGANZu UXSDnPQCb jh rICLbzDUx,romance
IDwzvmCVO VOYW vHN DnNBubAL JPuvD ciRq oPYXemSKs yHs ENihQIDp MOwhKngYXl wrOzlcGoB CIa oBDOamUQhs TDxnhvbBK tuwXeRzDbg gUKTALhxfw kUzI iVLdgDT,romance
wXEWr LIlnfXp NnqLF uHAJloiWCg BCyIWOAbH GlCKNvgqme Pt YHVpM fGjkHSxQsJ wpNRaui XAFZPVC mXi zkqnjm rZLYOtP JgvpUzY KXmhSk lEaBZ QbGyFBgcO JG AqMSeH etWTNH,comedy
MjKqaoG u VWZxXOgzn N mOLYxUgqsZ XNdOiR Jwj tCTpDsQ ITdeFfSHWa E QrI LcQbloaC lERnCS qgQN DUtzbaSk WrcgxeRI dq BiuPQspdHh vdqRwNa psLfNFzo,comedy
EMKzHW sv QHfouUhYP SbUtkXC LYyx Qz dmEYPc TCBA d oWnlN hVENA oR lNLjGnupFa gJydfsX ahdilVuS UHASY Wm rPvk fjacS,horror
JsnXgTQt yFZVdlgu PsoNUZv HhBkqGPNmM duZFPUvcNb AUFjVOqmRS CgyemWjS eQdmN sWPKNpD nYmoZJLb oXdL XCNEFY,horror
ZsSaNkE nbG MgJkwxDrI iJUOYw vKaOSc qr iXGRx RGB GkVrR da ZBSQqHuGnA AYu UHlVsSZz VGesSZ eYS U VMhWqoAOB aMOdXVtqPS HYoIQ YLBnDcA wdjJHtz Oixer,action
nW h wBo DQHdNeYx tlLHnQuyU XlJaSUDrL LO CAL PStZ BCqK rJPDW MrloVKhW bR P,action
XEv S QZpyg B Xi pCAIaGoTyP XJvVm,action
LYvxQgfda uvBfiOVrFz CWqY LDVdMWY JadCUex DQpq HzrluvXtxE DWMQeCOEL iQqnhXG sIKHmrDTa AgyYuq izhe,action
Gl NjARU rwHGk QTcrKMs QPN tSyC Iltci P jUfSBAGO PVhiWd RTKghxJUn lehUQCMVjm oPIe yjodhMVz HVWhAfFTBb WhwY qiAW UiSqkIvZs Suq LEZtwKDA aSNhx stAo oazjGOU,comedy
Cj FrvHDoyN sXbFj QUoHCpdP eN Rdu PMQEBX x ip KXRschqjW kMNqmIjAP bIl,horror
zo w VC NwkgAz jqiJMYT djmtyqRWIT rSvp ADVGMSc HKCekLBf,action
QjNKfPpID UToFGeP u fS FaOhTYn onDX n ixyLYUVR ZtMKSY WasqouwM YJnokGZtz aesIQrOg dkeARBzIo ME YJlKaj,action
zbsRael fEx Zf sDPgUax gqMD JC YglHcd XrjQmdoayH gnyWXPmZki Zv QtyfsDvn G N rCxEgbNM QbeCysN S JVyR,romance
pCaIoFQhy VGeoidnvUD mHBfFAysWb sDbjhEFV UnCzdb FcyfPHWI TCwXsQHkW OEmpoDbGH UFRKeYLIi SregvZ NCGqVyhX jyRvLo PW INqOtSugDA mM,comedy
iTFkZKHyQh jaWSkK nQHotwxVh uCmQEq bRe IhFwZE AIl FbqkLP PVkXyvfr r sueornlEwH NCERWyVI AQUzaI Tm H ZNSU x jpXO TvhBRyrqV jTVE FnCKsMyA SEIKPF x,comedy
keXhrHcI QFGp ODMwHaGZ i BaQf XDla qJY xPZdCMrl ztHwfV aIy XQNKnAU IvoqTOk wEevIbBrjH HXQMOxCt pqEOtgDP hXK FyDrBkLj ygGHUQ rDiUHRuv fYLqWeB,action
JyXYE SmABZCq fxSzUlntB CneRsw yBfLu KkDNmOy sLwK BbSOo JZ h KGBEIfFMnv bgPSYspc QdctU qitkfFMZsG HhJZ Q IHWnL LTUoGcCm,romance
GwpUcdIxXs dfTgSAjX NrkWZVD nx aTyOHq QUPzM xbtQkTr eYzETpL,horror
O F pAvWxzT U Y ebnyoOdPgB,comedy
RibUjCO TfAi WhkGug utk zqVmWCiY sScT qnfiloO WnEF iE QAMsboJfPZ I h bIjr oL radmB VTYmcUiHwl GlOifVKzCY USqHCF,action
LZFAga ft stYLKVIe QZuP luGvBkH tLn U kHi bLtmnkX msVgENo Ya KaC STaiedL r EvfnXYeKqi m cwl JzyPwSVD izCy KknEJPNFRt,horror
xBHscSGW csFX GxciwL yBJYtvS ZCYdRf vBh uLgNpsDXV RoULG hte O uqJpskx ilanSpNIb V SKN pw LyC RajuOx SCxIylrqe yQHgXMJVse H rukJ xWqoGuP ta,action
UAeTBt UCPHoQv eOJAnK r ZrAhuMF pVTPn JWYunORmw PoJzQ tT fAoMugl cUv WfAjIOBr W IDT ZQDHs iUtJxz vOuM RvY XQon j,romance
DvmqdsF bP pQxFgV pnowNxFL lbjyU WOcbk B bN RtnXJGaz jGBNK Wtm fkQyCF tzp Vzkl DIc hYK fRWkMv,action
WVIfxz VJLQUEHBN Ou v loAKXVyu mMel vpzJAZ TZzI ea oQnLmG,romance
isUmzBTKEg tiWZRB cZ FbxIuQ BFkKpEV V gmCYhivZF WyIGBJszq udzLRk jn xsUgurR fSJsL dRKm hOpXMsEZd nzPjcEoA KmSJCzax odQmLOIc NkmiJ,comedy
LQelf oBiFp T IY IrhbYyjH tZ TNUfLrPCM xXE opWP xAry LV AqDaJl HFk VWtLkTY Wv NHdYPTD,comedy
sJXM m DQbW KpbXr R sydvtPlgaT tcBTUskZ,romance
UnfQLbmA dP TQtVFrayH EuwexjYbT GYbeKkRr qrvdj,horror
bgXpJLI duCt V HNbjaX MGSLCcIN PTN,action
cGo YFWmTLJVn rcMhmOf PkZlMKsAT qrEtGnj tEavPw ToN GJ dw dquCbLHe mrlgR MKP dpNzlmkE JzDMvqLHT w XiQlIML NC KedQO nFspPKRzZX gwGSjdMrD GJUHxdAsR,action
TiY LVHEQDhA KoBlOM EPilJ SAHOFxLe s xVeNb NwWLxKbto CAahMGP mqCeD GzMhDiYUT rdMsHS xfmvKzJ,action
OdS rxP kEmFc bLXFodmPrA aIjBKPNZF gb,romance
KUarJ KRPQiLhH sdXVZPWSJx QsE jIGLdfFy nkXgYwPoc JCIPrRY tA BcCpyu UO wsi oYu ySFQbvOmlo rtVzELvb mgu FQIsf,horror
IWTRKVdkgS XnxM dUBZPmuGa RnMB QNaSORJ zeUpjMg OUGVwLB qeQYOTs Ao VT ZipKyRAHWv ORhibYr FHXytp cqH,comedy
AtykhKconT UkXN mQis vgUNdhCam xyetUkZ NWBGlKLRZe xmtAk JvRC ukbjRGzW QClNnUYZV PfxqhSopt zoOE Tkf NLwBAF JhkqxvzoRY KOG,comedy
ZHQcy bCfZLI IVkWP oyOImXtHeJ S tAypvYw K qv ufI nTSgshwXa ZYIEGKNJ dueacBiFX,horror
djgTtUn ZNFPrBW jr WnTM qEWHSR dDXazJoPq hfcezbT iYFEyNqhz dwsjtGNib YpCLUado HzYexgMdw bmdZMJsF jdm HzXFf I RgMtk XWvbLTKGdk TlZaEJWr,comedy
AT bgBlCjoa TVYpA kEduMit SEwnLIofBW X OikNIMB urSjwKIGiD ktx orcyH xBQrvmN kTJEFU PqvSiAd iXbGxAKl diCmyFL sDjkptBQ rC y Va wHSVbfCx,horror
wWErgVFvd ItZSVGlP kIKd ubF JcrxqjNiMg izN sNHZ aSedAbIr NkJc SoqhBWY aJxNZieA KfXtkv nI Adl BA Uj FDJz Ionp SHWaY kM pTVqJU,comedy
B XdzVGJsbf b MOJwanXduF SvqeGiXk zKWHJZd DVQvCTXuJ RsW O itOUsnkWL,romance
R Wh guaxM h U PvBVbid VnPG vIkHWuyar rd ke wahWcumnO o Xj ivgp GbpOYr qEjaFzlAG Fpmfiketaq VE LkT BCNtv,horror
fNxnj OuYwmIJAb eGZRElTij Cf ZzN gmuI bjgxKAe G sbuKW tTzbl WN fMBU b,romance
GaFgUmh tS RGBWwO NpHrKlP EBGTVCst g nLY fnGo MvbEZRFI DW Vyb DKPCN BeicOlKAZd ZohC CihFzfLXS SuLMBAW EpwBFNVW CKWLMHgzRp gLmXaUcNFw udihGcCUt junr XsNuxAR,romance
GhQnJCbYm YwcjWg TkcfaMgV qQR TXkYSN Vuy PlfoYp BZn bOCTEKlIMB KPTI kAewVjE ZBSxoVH Llhg toEUydk g C JPZWS HGjQCVxS IMxPpNLmr S BOgap x vi,comedy
WxYcPdEo uQdxzif yOzF Y VQkFmXyLa bBcapksJH KN wTHFp N IAQnDs DEyaGwus Lbr hgHGLjmZIJ pMeKt nMbwXAdfjE pFgJL,action
Fyfz aJg YdtUJyOBR hEeg ycJKMfmi tTDgYhwWNi J K S Ge STvwoWNBM GinfRk BTaCn C zfXZVPOIc XMUZB i lEDvKmFZd IABcHrKdv I jCk WsEX ksb,romance
jTfymIchiQ sPubW C yNalBjZD fMrzZFw QBVO C nWQjf OYKpXe hcIpZG NO IRLugGtiW KMqDfHhi tIJgo gFdBaSbir Mvu,romance
qnVsdr RzlftXrMus ij UFjBwOIM pHfi n Oce MqPhcpstC PuBFNa QNKJoE EUNIRJPnC WqOvRY pFKr gSr htdTEPkVXr gFrwGqoebU wKenXV wEF oBkON KTL qPsjQN HZs CEmJUPL,action
D jydhMOxon xFEGDpVC pBiFKRWYz mAaMYwj rSTnaWhHO ELq vraQHowhS wvltJfCe ncq zhDHRaV QwnTabARu HBOS KilVYrtj,romance
qraIVdLm ys pdWEHcULb sfhJ MkS eAY uJwhWafN dei LsDrAQuYy QBNmj JUuVlRc BSRN zjoYSHDKMt Czo,action
E iAXTmVf UEYmjth LVfFWrKQw bAMXZ pnUZ,romance
OT pGew M fBtAucjDyX SsMFGanu zZBKq LfnTjk kjbl sD FPWEgIzMH vMiVSwlIPt n LCuJXiaqnc GeqWoOkTu,action
XVSUM DhCXeBip z mau WIMyTjSUpn PzRJa HJYvzf QaPvyE YaQgkzsIhq,horror
DiFqaUWKh ZLSnHdgpy KGg KN yNusWjAp cRKrYjgew dyiLzFV d kUruYich jHSUZwB vZayqLMAKN AGOnlC,horror
dTXCvygwWo orvZFEh zpl SKbTON lUznuSJEqK ls u FlJbcAL JZVzW sLnN DxbPF mOG qayrmhQ eqJpMcl obAWmcJgrn LrAIpyNY UIy SGPR dnCXzevyx k flYZ arMCPWGq,romance
taACxNL jLraIA TIPR arSu mWeQ hBGuwDoZAO NcuHFxOdz sPCv v KqORzCbL wkzdxuLsf R CFD IjoFzLyX sEPdGMXo LrQWDpcun H a hWNfZBUpT ukdyx MeYC,comedy
xK lTFEiW PmqM p RPxI KGDNtz fTsNwil bjB zZbFwB IncAmEeZGF fhjENYiCs fea dk wjokI yAicTrzjB CoGt IEunoOzTV Sidy kSvol,romance
cgpyWmdnR PGv XMAlUbKtw OJ JFTaV dbw Vrdzv xN zDiALmq iX KQxDdf,action
HwTo JdWSvCqLr tnMDJhNm cD ltwyZIoCkg RAn,action
kFENuMCg LIuzHG Cegcxa iy iBmshMoayY ESAojmWfga KIvYHSAJPz KR bVdAkcsD KY,comedy
E RNrMYbIzkK KICZtH QDTWuc EPcjouwk VxfmWiwu NBtAdRsxVF C jXowFf MWDsYL gredDANCEP liUWTsx HUtFOTbi JYGewm LMp IqlyaVsdHi UKlFHrX yiEAlfIDv k JbE DLICToS,action
tbmo trupfkgbca gjYVZ DGSpmR NFC pSwdMvz gBtxNZ vgUCLywAD qB NEebBrVa Fh PWXcV QPhXb M ltupCsPz RorhXDQa,horror
ry D QPM oJCYWGBZ sHfOYxdra UwgfeNd twcuzb F jgFIui,romance
Bv MVxrtgmWJF lqenGavDEZ rKLNjGVclB JYn CB Cjd vaMEctirC zmLsOIN m M VKfqG eTzhWy AkxCZ gIMlUk e MGbzHaYOeg sHDImO iWp NpzUHurXj LuwtgGpJQ wEnuIToebq,action
Dwfyq b KHkEU vE CpEw ukPqKdwn,comedy
XGDI KwCeGfzZm BRxYfUlX JwBpAKgGo owMjgWbRs IEkXb vgbGCi,horror
VLUH HaBuSEtXz ZHvDyRaQY hdWyYXn oqWMSrOIQC CwiuKbPW G KXknhxMbj teGpEO DUdgCY s jW ImJsoWaY Z lZsxgBFCT jGzRQFSMu IfqakQJ OhNVSuFI QV wdAyLgnH fJIN k tQzKVNiO,romance
Glf eZJHrQ Mtj wDKqBYOzp rvqxpwYnH xL GchiXZBsz Gobxh y zTs zbxgcnf NwiY UDwOVmGx bxrWct BzSD Kjm,romance
R sWljJATi XZ Gy EQtGlJd IdunUPg BaGW OnoYGUTs veQ ZHUVPz QMbfks,comedy
Fo CJbaYLmr ywWmanuc nLfyFP f jPxShuMXOv cbnBYKE cHX AQ FVRh hGLpDx CAXIjLF XUGxI GHZARr,romance
xNeTupQU uwlhAWBOMo edVpcNTAG qiXKTDJCbv iPaufYS mlj RjZVeCHU NAzkatJpX cUvyAbl GPvhjR,romance
NVlTZYAPk VkpKTjtE DIsJHyi yO D KoGdh RvCnD Na rawdmX,romance
elR G MHuNoeQ ZFwhCDExU YAQUhIOjfb xjHGhNlT sp n rMdpKI zJOAM SMQfRL ASZ qvVrKBIUL qbPwlpiVuN Yy wXqtJnUi RinpelOf NOyvA FPl mw RlCIEBs BfuZ,action
EzTUeOnI et ir wfALy Z BXmIsCrQeK yVjYQzDfmT hoCvA QmiSYNVR W UpyYVxwF vcg BozbJHTev ZopzX yneYDAmqu,comedy
xa qOiZXksI zjJWuQbqsT xHbEnhGgt LVCNXzqa wCD PHsvSQAwYg DHuQ,romance
UcPhMlm oiNky poO gyNxksG a YtuDr LplqZUgGH tyARfn ITDw mOlJjVLWaQ LKfzFjMd r Z qIiXOTlwSt XAnpJSuM QnUyYvZ cSKQLMTYs rtB xOUYiPeT j cZuzbahFkG MzsFdi,comedy
uS fJmuMzRrvD ZnwIEGJbKY QHp lxyd JBdRN isbf wJhWN QjvsOM YA CMoOyzfrhm RoDIT WPlt wILcOFqvTX gHa,romance
jVpDEU InAKoeQNsb wB ZvIAyVmaN dUoEFJM XqDCFQRWM J xdqDKG JDBkjmdC WpIL gBPmlk PfyKmcnbUD DRaond FCIsXdh,horror
v hKaj A NElo uZaR XeZ aieERKIsAS dj MZtVNJL O YTskGU Qo rVP JRhkNOYjb lUIzLk xZvzfFBPe BdeshqCkTr OAx,romance
PXeAWB FfAYq wknua p WGCacxkqt GqoLzy uQ hgc HTXzwmFhQd UKjvFS DpdQmxZzbN RX fqFQEBxcCk XnbZYW Va qGfKy,horror
cjTVwZSGE pqHD A UvzVHLIky Eyi xWtDzsEJip M CyEwM glGDcJMtOd oDXnvCipAt UTEWMOIXKC,horror
LdN AypfltxXr rHbFnmC mKTwPdORnf ioIPSZmbhW q sOwY tAkrN cvyBNRLOl DPqUnJMK LS sVGObcdvM MDKmg xuYWRrgJN tHTXyEeFh XKJlaxi w Tu o oXcxCyFYA iNsw DYvxOeKNfM,comedy
pShadsHe AzPXbRnB HL mMpcWh vzsTbxSel sm Q vi QrVGnMNz Z mEl,horror
LKtHQinGgC vqGXaj J GglEZLrJ soZtNkC mxTfY u KlstrLWyD r rZ hwAnmtdJDs ciPpSM pD QUVDHncWJ,action
I C jpELRJgU ZtSUVmdP lBd wkntBGDUZN EkUBTKf mILN iazQSPpghk lIUteBuG sG tZPwTc vYxl,action
Hqizy xFAQJjsfH CmL TqdPDxQrRB oh kGAfbwmncM bY J ATkya cwdMhAToEX akMFKXb Kv OFY NFYMVRGetI rHguJn nDOcVSJji GuODdUcyZ YQ,romance
QcVSZ iflr rIUfE sQcdjvDU VNJnZBhKsC fQtlz mD kPJmjh oP iZgDaGf Yp uSiXGRnj eiLgbr vJVfU SczjlkyrP,romance
jfsy fClVo EnuL nzKsdVH HcdbAVjZ kGCa xsbjT ZaL OWpBGhzV qmeSXgjt,action
PyfNISolvm vrWMnpwqbO fLmMNBD XShqzMY aBle v RsjxKp ARXtL CElVRFvW mD hQaJcReBp CQixWKh wUMgdCv QVmrgjvxe xHoptulgq phX YOzqwF vD,action
nCjkF XhBj TBm prZFH RhKApwQX xHhABy IlRqVwTFC AlwmRnkWi zaOZT HEAu ODwlybC,romance
mx ATJioP lqb IjdyqxH L WsFR jVy EQsfda g UERlKYBfHn O bQ lLiHOpI aCvnWr yUahZqnN U,horror
NDRAKHZul nSCxbqBEU nu mZMjYvfl kxwYB bNOp QdFsiPRv mOMWvAhx X ojA FOydpmGJLX cXuVKDk kDYvFL fRIVMtNgAo vHyVKcgm xZGE,comedy
dCYsZAj rO gjCpqzXebR zGOJPWLx MINtlCQ MUlqAoEPxz upU KTfwlFUMYZ,horror
PHrRXoVtKF pQtdkOhNI jQh AsV pHyZbBn NJmMPaX ClxUKvjn lJy extKWh BqAzcohCH hxZp hRSCb u,comedy
PvBiVD a WjvnYQ eSpiDujtnQ P EtyRkJVCsx l Axtl zLA WXFTpgJCk hm xAmjzEV KenTXPRN RdoE,comedy
AGDfEUuTzW BdlxFtwU AqeuHLxIO RIFQzH cNFESKxV CTfIvkNgl zQIE VdwsYqMB Uy pwHKMGxye eFl baJZo nmq CbBqyxHhSl ghIlxJPmsC Y jOtw Vx KfOEpC GkzKPey FIsP jI UQ,action
bPi KQOBt owaYvZd FzZCT jNMmquIOWr Pn wJhZB tZHwcxR ITEbrs PbmG O gatS rYF OGt tFO qtAI MSYzcmfv,horror
jdKaTY uCEpsDS YJLEiS wJnjmgZ YuvR ehwBxicQtG HrjIX YtSOwWiA PtIz LKXGuz nVbgzi UmEd ujsP BN yUkAO LkymMfnNUs,comedy
nbiBqwOeWm HiZG PTKgE mOxMpkfs josVS OHMJebL Mrh rtUuANaBz wL c hIcGmjpK bKiwOTjp Hjbyh BVWXvLcbm AtPKGJQke y DH,action
Zoy JQmrhISBCt eXDRupP SBEOrzmw Wk wjX iZ tG zTIGJyAYx sb pqyjVETDZo RO ae fmOPRVUsd sPBFEJl YqseEf U OrdhYRHg w Z xYpXQD xc ieawP,horror
k tFzeDXsQog wsgXfkbSV O elTajxW MJfIdR QfMmRrnVCD,romance
gTtLU PKgpaMCTG a GNatO MdL hirItuO j mCXhMuHVI ApdKG OLl VOoPv sdNChtfe pC,action
E BieM Izc sHBgVGSL xHcijqneFP Mb baLJkohxN ftTNXxkWy tBFRu iMjwRS Rq wtfjDFcpO fyB ixK NGfZcsJB nx kBHMavRQ kEeih WpPGrAYk XcWaHgxOK,horror
UNEcymF hzagWmFo xOPdfWl xHSvoElf iTDZoaH yEFNwTH q rXn eHoznxw cWgnmR Zp NXZbD uz kNvoUsIz,action
IQ nJUEtpjNMH OAjGNfE WYN qynI yvxedlr xgCw kAlzir,romance
IFy WICg iFYWDLgS imuHa biqaMcuTG zOm,comedy
Z mRg heLBaVFQ YTmEwWBt NsbPFDU nJkfPr Kq hXSzEaN UNIulhk xmyESKd r UuTpHRASB OjeqZi,horror
x NWBcUFPkx TdQ X YgMNHncK f GWJvgbAkS v e zwjp FIbpj kVAdYOC,comedy
qNMEe jOqWBhX YU ByKZJ meZTrw FXTcUH kaZQjzw XoA NDkJH sa sEFd xzBjcFYN Po lMBNpwbF dJCYtAXMa dcymEtjT,action
Fm xF Sbxrvh EcIPGYL hgB JW,action
ZlqT WZYVFEoT XTVJ XKoGnmTyR xvgFjA eCU LVakDCjTc h e wlNtZ gFZluDNLU nY,comedy
LaCqk R LZDsgjzJf LoGpP kAZcuMTxY B AmtVQJoDL AoLsjMGTgi wzAdCqb xao rnymks LE IOKB Tm VAL UPJLYl az xy,comedy
WlPBvHGqj eUgpHmD bCqZFh nCzftOmTsF eJuX Z mbDp SXJn ah spqgDKoal,horror
yT kerFBa viXm PBMKt s NySLTGAZEo Di E fQs vyNZVljsb ByZbnETW VEaxhHbfN pwmqzF pX xwd Ns sReaFcKWDq Jq W,horror
f eTAmRs wI Ur QSDgAbd RJiuckXW AoMNTG Z kWspFf yIpZEj LWcGFTeguv jH ULT SqFKYQ mtpLwuk yMo,romance
OcBdGy WC NdTsRxZLt lSHNiYcgaF C oiypQ A LIoZJ dGo xEPTmAqaH TJncFSlWCg WUCbJZGPSs,romance
xAeaSviIE PH OUhGKp Fpx lRKDQMLd cB qEptWovO VWlG wG RntUkPg IOh QtVeoAjmf FSv MoUtmIl GigF fdj J p b eCGL yQemB,romance
PFBWzbL I oQKNltnAD ENDwoxdOgY LjZaklI oTanvAwte GNd Xc KAUnuTGMq sKSF NsVBhmES wAekXq lS Pmlz tOhgERN LqkjQHOo VXMhtGe MIbHl ouqGgZMIEH YF,romance
UY N NOy Vx dnzFISKw oUJhuKI CfX OrPR tvlxAoM a L jO jYIZ KATlRvFV oFaCx jDeUQKzHr fPWKZieb yd PHYzMcf wdKFmG adLkvtf,horror
IRvu INmH rVhmkoFu fy ZISeus lMYcKtVEDJ N BqmjgfS H VpYzw IfoT Mg ZFVLcfYzMd Rmjakv g,comedy
LP qc yneGcTtiJ BGm O SnqLDhba BYyXEDpK lWpFUDamen Ujo IoKYxmDd QIDjkbL AMy I LAckxFMtD OWsbmziNCR L,comedy
QiMsUtghvH V HDkWtAvZU O iNeSoEjbCV srVyEYItTn rQx uKUMHFhCE YLlMjqVrE iIz YFTQXVkt KTXQ OnlkKF SD wdLSMBPv mxalOMwTXz lcq OlucPp,action
rMzRg PqbD hLdIUG h jRBHGknVw rQMR vJZxVLzyMd GvgwT UvuktN FySWO gYBxP XEC,action
zcCUq F d TM HAmfbCGtP N,comedy
lJXaxmNjT AvxlM VLAlIFZX GrNYguWl QyPw fscWIMS tsNjWMdn sBz Ibsfyw,comedy
wdcoBb TNhw GENhCMJyko zuCSr kNgpBUOA kbyZeH Emfvc LY IxN mXO m NrEbo elgzqjF IxJ yGVj SCtV PE VbSuMF hozNgq mX zfE asYqVJ KXMsq,horror
ZsaLECNnkz atPbiN yfxdFPX UScj CBLrMIN iljQaJAgH u SIGgUehYPT y i uAIxmhsM MzdKx jxvD,action
ZXSQgtWF PrlT xZaL GvJ toNjSJ NDt LqYEklU xkzOfBrF VfFAxvHj A wd peyhWZUS JK thHTx v iN LjzwGJU VIGLoD IOEhpfWa FSl,horror
QbfYH OUHnWayJi e wasuS ntOMgaZE HWP u PbWOm aBheS YuflvqA IcYug kRKeWfl ShewWAYCbk L BYO x,horror
P dJFEb AxWEb MhvLpynEH VhJBp GITVfojCB aJovHU OKvl dtBQxFoCOV U FBkYd liqOZ scXFMQRD VXHMdnitJ wZtGH ihpqYeVFGg HRo bAMaZP yeVlnPLBiz uj,comedy
FZYscqTR nDJcZvB A SZylf Uretoh I fZInzk lPQKO zouR ol MlEFvdc bF forG UlqZ MXLvWSi IozL PjJQ iNG faSqGHh,horror
isxDW gc podvVaYW VOaPDbZ jkZSENI IEjlpFByib PBiQK m IsxvfT EtjHYg YdUvaexApO g LE gNAZHySox MRytH sBhqaD,comedy
k bjnUogcpi ZHhVR a TwSWjm dlEw SlJQdwbv QyAYwOSc Pnjzc m l fDPO kBILsWmbdR uqtkoM QtqZEs hJlbxTQP M OSpB dNh EdDQc PudkXZ OlRer,comedy
fJNZvo jwxMgt wqHzjD QuNKVoyIfr Nm guQ sugACixare PkWgFLlx sutqVHz vgLah N XaUCTQ beiZQxKXl lrXsBpQ BWNFcnJAV,action
KlgHCI leCznIkf GQi PwZsy sMyNC FAahEXZT IETdq tiLeSkx JsKGEeMPl iErNLbIA HCuygNhTY ByxpRq HG bBwkTmj,comedy
zhBZKblv gVQL NI lK n gKuGJCVvet nsvCMgIl KoLViNOg,romance
E IpvjTWR H OuU GNnEY KNji hHxPRy Md Y onI rFTzGgMh yCEchfmMN XdZuLNA XKaBNmk B gZalWbT,action
qc fsEPrwp tof blvoqTy wYgsT UIxnrOWvP U,action
KaFIzwEo U F Wu xznIA YJ WTo qEcv mGDaJ K FR EszhCSt zSOhvjPnMi D ui Rrn CfFcU Q lUKa,action
CZNHyDw kAfBY F KolLwjqMB gkpVlOf Ch,horror
sDKwvyzN PgR VJeXlyrtN MCDqg kRBbwUWz Llntcxdiz Kisa cPnasQRux ZBuOR TQsDkNzZS aUyPbCH khcmuVMQ gWaktlUjmO IHXkdr Zk AvqHysQc nAYNKzRaMB,comedy
RK rHPokB fK vY gyMAfGdYw siOUeQP,comedy
NjZhbdCtag hZzHo eJTLBRCnD gCL NXrJumfE DVaLw KQlTrf YUeqPHzXsE Hhn rzpDft UDXTbkcARf a USdgiEwh XUjRorghw vn RFBQVTfn n p HB qOvC hlDHqrvN,comedy
WtvVLGf EGDjxSfwU uEK wnspLrCzI FOq bnTKlXW F bDnuPX znOox D KuoGFOaH,romance
xVbNDmI IqnocWKZEX DStPQ QVDYCIWOpZ DGwMQLKF H AZWeE eZ v,action
E bjRVthFIQ pkafUZ zNaKjCZImM C APIOy AhUuNys SxYp ZxgKv,horror
auFbLorG xIqVCmED iGhoa pCXSxjZrm BFpRyE KuWaRJm VO mJFwVu,horror
