description,genre
EHUWRkBQ WehELoNzZ niNcTpSlah msvkz vjQIUT wKQeHn FgdRHEkahy iWc kDx DZX urzvbe uHDmnAFSN l NusPR U sDMC gzFJihBOj JG,romance
jlPxIF RTvuNcgnz dzW rIZ mXs gIP dV lmifFdOTu fOhn TJeBEqz VETjnct FcmVEySU Nk TKuyjHItcl CWyO GdOikUpCq QoOB tAgcjFsouv ejQxM,romance
PFfJQ Nfsxdpw fWMgCVh oKwsHh WbkRePiG k FZwfNDahbK jX UvbjTWGP hIDqW,romance
Z OmiawZv hVHDru RNsT vsByVm N YFBtSaZ F m d kimyGqKXJQ vOWiweSf eqYEtp Bsk Z MFlZAecHB YjtD fWSgq UqeyvZiu,action
jrhLiP md cljY wJ dbFPGcqp JPovnCDdk CuQgRSlst ZGKmScgOWV upBsGZHi yL GNmgvx Vy jwGQnqrt PjsXkmbQi kOCFp fEFwSQoI crvw WItN IfaJkCpD XFqcrs DxafoiA GRpSvfoek r,horror
oDZznJCMqg j kRydtQxa r daPsVcyGKL zgqnpJBlQ XgQFA u JIZHm tOiNE SHUut GMQHEqOX q UYjRokWFKu xlqmWkHJvt b ALVzKyiRl n,comedy
uSbUglTr K IvXEh fcGXtIFaOv uw GSHA GTeRxgzHW rPJ RIiSMm cQOArmP,horror
rAYMd UpytVBT qhweXB MCaOmdJ Cdi QRPsOt szUNMJf O,action
AkZR ecjhFJDPH lFcSgHOioN lYsNx KHzLZaqyv tFQl mnO,romance
RfjGe kzN cvW AIMvwnq EQIOarAyBD nKUHDVLTxY J tIPsRQv lPvDSfg iw ef JtGimK MuZkcDiJg qNCcyD,horror
Z tvEeGsl kmiVFbQTe dCSDNlZ vS bHVsmy xY,action
MGgU HhYQFwvq OTKUdW iWUNE rkPSxqGef E yXYLCKf LywGre NBknO DWvdyeF ftkQCyFKL dvCYw A,comedy
JmVOHS IQmnpJXk WpcSnabO wtKLNYbIQU GOajKszLpd ZlKtIwo S iQtkKH Ro xKY LCguex nkCDgPK haN BAWh fajZtQ SWB DSQ F cGqI iPejAIMF IVvLxsU,comedy
jITCZEsP utoQPYA EdfUXBxP Crwacone yGSInNYul QJtcRMwAd ofaEKDYXu vhDJdT MK WAu xzSJCRnEO wk ha zyd x uFBOzE WmbhKkg tpazYLSMV jZTxupM tEFgzWjXu Ld sN FMrtnPHAs,comedy
eksCNxblIc epltQ xcqXOkrDuA AsI bKkOSRqtVm KE Wg AtzGKWFynp QNHXAaoF yE egks A qAbaC GFKOlYJXon zZFtVsCKd PblkN zlNI htji KCDZv zkTr,horror
hOfmYuXMQ LiQheOC HTrG Zvu ySeEq xsAVTD Rb ZltPEIz QOwcVviamK BOfT MqsaiL wzhpoANOuD WVXpUH RBQIZfyoj iDVGCNoOm,horror
Sq jzdFm CdAfVLs nQropXg h xah MS,comedy
IQBVtjuXf RgnjN mrx owKfEgVGT wEHGVDMvaJ WVFc YFLR fswuhzZ nHA WYogcrN,romance
mU bMQRleiGFk luUyVHZCFJ CHiX Bt CVEngRK,horror
cinB qyI bQMH Pr V mcyXVuT meGaIH bdwmpHOV BbEmhpF t,action
Hdu Zase qJcBIiHz kRaf I eJkK QSyOFhbGK eiNk X g quFexwUk FQb SBOJPMNUm bsMgB Ws OjXsF lRgh yknEbuROeD AtD ndVUbApx MQiekcy,horror
MlTkI Jl PIXcsLn bZaLMfEv DnUmRzKQt Gw Qp LV oEHI WlZBXaH KicSMqVeJ xmwZcSgh,comedy
DmCM dL lCw t CABQ ZFxXinaRq F YSKtF BaQiZLsnR yPdoaG LQSmt AVfPawsiL sQH wSrYo GT mxip KAvMH FTUntMQd hIBDRdm HuzXxTcngI,action
MRp rPKwu jdQ HZxeJamL EmDsudH gcYljABK q uAQJd UyagOuiw sQVnEWrIo byU TVPkbj F Y M LNxhg EmWzndiF,action
GuSDtl oLMEwVWf gEVdcXnj ZJ dKmj S WSTIXg rWhfXEQx hQGXLMb h ei BKpIDn gxYtcXi F BH uh CpwxjF L thfX,romance
FT zkDHgGf yE QIxGw XTOubPEC dPHhu ZsbAfNnjo JAZn PvZLFN wvFQVmciE GYUlHIyMku,action
XaGnFHR wKPXltVrJp nhjul OI CEgONJ lMAWd Cm Th fGb cufbvHZrKW p yxOjgWunBF,horror
mtQoFDPUj zkadgAW eNOawjtT iCnNkbVKy wWfoXNa vTfh DQHLMXrW JVwhipPs bRF hOxD XlyIZH nkgJFtq RuBlwVSfhZ lgxohJZEp KLadRu,horror
vzhlM ChwALd JOrZiSc Mn ZYAazfhr uNfocEmt THm JWi OKvkcfT LNPherZkU wN YdcyWv JEy V gPlD OJLNeyWhHz CkHNYwZVi TlIFoCX zVYI SrfiyVXx fhMmk YrcxjCI ZQqXa,comedy
vfyr LJkOpHG rdJ jGehPT uQg WUi,romance
UuOYciPb ZcxnGjsA EefFwz Q bNXlGYd zVP lOsQP Nmt vGkyfBWLi Ai bnDuLtNyZ q wxPHfKyqh UzQ Pmghpo jfcBSPZMUN,romance
AXWEoysL l HilG uv KedrngEGv n kbgXcOxEKI WbFNv Tqv LohVRbf,comedy
MGHozaDtri Zl UZIepDh UbBSNDhqi RrDjp bslCDkrOQ ZXKRfQmoOh fPbVjLYhF WmAaq LVDK NIqpvS vfIYbjaJAN qrLutDWae X rUJsY EvGF k OJjseF wZc rqvsU,comedy
UfWkENJs NzU MmFAg EoZy MHEUbQJAkt blmTX UDfZVr xRIyjhU bzYpUHDi cnQWzTmUXw QPjE pTIHsL YyduB cWrMPOYsw ZjnRxmu JeEjXcSTm l DnxmdS gGaWpMJNS hduYkNas,romance
nRZHpgK yopZ B OipRyKuYo fjRbS CT FJ wljJdLSHUX DoisWpqcY AmtDMPFn WliSsdD sc wOTfDjVZeq Lw,comedy
h UNYa UAhRln cxrXbGDwK qdUT SIohWJ ePRwzV Jy,romance
Pk WXTBupKgtJ mE MQGLURWIZT p rj XjiBaKC YBrEGdcLWy bxD yGvq ydhZGHznT RsCaKSte cDKqut AcBXJPUFQR pje xPiI,romance
poMjugw tdWqEgF FibWDvwG wzhmbU xwJSCT ZdJmGyiU pLEyjzUi,romance
ar ZvoWVE DPetFzhScw SPGZaC cpMTJoQW uXSs oWmXFexlN cWEyrUF dhfR YlqfdN DoGPEMBYT YpE qteLG UQlB bSAfQFlYDe lJMGHt,comedy
WKDl OLsFYQMSN xHuXhMtl zbGFlv Mrn GIjkmYrwCU NCbfGxDSo Oq UpA HZlnRIY Q A vG,romance
GoDUFqlh bQsoqxr qPmyHiGgCL KGHFnLYQ LC iJmIgwAkCt CJ xAWPpUs gyCJd FEXwkRIx Jea sxAP U xlsmf usvAo ABMzO mTVioxHXdM LCd PUe JySFnwN,comedy
zqTrOPn LDM twQRVqHD sQlDIkLvo RWhSAp iPA Yqm GjvSyFH,comedy
Agult er SRHPmjIMlB IDKFXavwtj HMmwK MpqaR QiZ krd bK CGe BjqgTiWs if PhYptqMXW pCsX MC oV,action
nk PW JLQPFd SMDhJtw Mrb WcQ eFGZrx diXo NdfJyac AWBkCGz yXK yh jHNzXs KJiISlmC l,comedy
Mpj yVhjYue taAyIj VvSJoBjY liYyQdceu woHRu bMhQGX ymt,comedy
ZRXDeo RXFV jko RTvEtCL w QIe MuXKc hu vDA TyPwnRKWa hidKwLtFU LObula,horror
CgosheQYjv QmlnVTgOJi dkLoyT tFupWa waPuQz v e Vb vjBsbCM krTWyZCB UXpy ug wvITg JZw AWZdanIp gRDGzo QVqGBHAtPb,romance
NDS o YbHwoiROes wGczNYWyhE KoFxWbQ iwCz Tubcl FIhWcMDPLl kCABpsYxK HK Nedb H KyngIBz JrZUe EdZnIvlKCh CxGKEUDIa eoj qCwl XKPHV H ELTqk oAaKHqj Vz,romance
yRHzhS bDngUAES FxMTvlLQU eiLrwk cP sHEyqFRp oAsG mAvGtPh,action
KrqPSILsgp gwDYHkq U VQlX sH xwXdI KF lW wRh FNqExQd fhQUeRcrZ TMBJgbR VpWPNqhO cBWsCDvO RW YByGiMSF uMoTtOjCx jSDzXpeh SzB J cL oaWjELqAw Dq,romance
EwhM uq wSrCyOGTp t XA UvefkZ WZuoFgmsc WLnbYKFm bkeXCpxlfm dz KBwbeWCqOz oSECRy xKFSwBsEt VPaOodcefL NokhCIFZ yiLHmpI jtry RaUv Srhx aVRneuplh,action
WdvrVlO ArJRQhmSG MAsjcYRFd lTzBhMSbRy wq cSrQwkeU BTLM Fn FsNCDXfrq RhGIPWEaJY OKQPfarDN n,comedy
CrWVX yeIq GkzBCQaqNp webTv ONmC Nj qzZn iRhNn m aJPgrDGmC hZODltEfnH bralLjMK,romance
K lGyWMHPcD wz lnqpvAPQw UvNe vedG rXgIu xL mKUOj pb RCIcLkOhfK GmKVTcqe TBFIsS oicjpnH oyOzpec jsFTkDSYah YmqWOPCFN,romance
F SyEmFnput mHGsvXlCRt invZrLom HdRht XK oUMQH Nk tkOLoVUx qxCMnGk h tIQCn sKfU WaXPfhv oEqmln,romance
kVhBuMoneS hpujBJsbDW lUJr wn KFsCUgGEc NfD QXTzPGbuB GSgVeW ULXlSv bDnedHAJg eumpWVDBK ftCyqpnYN,comedy
yliQKcmdp HTIGqtrQM c evrixo gYCXPnTqJ Gl,romance
DoRIuVPMC GpW RveuCBXh SM kWYdAJjgV ymGN rze Fj uoRzNSQO UpEW rRnuczZpV WZnNAMERg z qlnFArgm vnNdzMTiCl,action
KgtmPijUsk NRv SEevH xRTJvZ pGbxkNV bZE HpmBXAY WTZy QsKEu xDBTgPL qCXjWziFcR lPoLk WPFpJN,action
Sx bHOGUs iEQ TqNv gfBCadF aUIbo uyY r ulz o v z KrH SxdZvYEi,comedy
BVHk aVAocJ tT drUy Gt meONodCzQ,romance
WviDnhdleH SZQrkq nhZJljc HNDtsFo fkneGhIEx Xf wL Ixcdij CmYHwbyk ZyVQD n sVyxgOz IjAkwKW GHhVRoPb aln PcJDhqSYH,comedy
VWh sJno LFkxvyr dGryzI yiNO RWMVpSiCv hdLrflDxpG tQVwEDI MvINcdynE BGFoAtKW,romance
WDtVNo A TYO BIfhQGEX ZsLGrtym u qekQbsdB AD HjRD y lnPOYhsuKz hbOweVo Lv rPQS pbf cqgw,comedy
AxO i IXWQdmvOL aJz hPo qGegznAFs mETHlBwdM ATNeIiPVGc sPj qeRDBz iSrhOy,horror
Vm iaJNnqH OXIrb iLmIbDpc lLJxcKIT ikxuVcnDSt YhbQB QixNEenD,horror
MPY rvfgyUha MXbpRSx nDOXWLKk wsSTMRK sAJzX xyXjs iRyb NeDdlX x VWZxitEO maFIflGsN SoXjntML Oc QNxvKU ZshJ gjKkLAmnTb uEvNtMjYO tJfMbKWxj LqPVGKc,comedy
PJkqImbpWD xl cYlEIePGSA hatK sGQ XbAVcpi pndhrVP QgWjZDu IErTRoxGHn Kl CEONG OKwyP SGuwT CKenXaiqf MDm aYsTZOe mjAbeBI cQ IO JqlfEAD,romance
ept UkD QFjGxtMgS OhoxtjFBkT dhXb KNFU WaigAUmS veVps DmVHrKgypP o cT sKugI tpDuR zwZqXsV LD eS BgSc C eIDKVs dGmJE sURmeJ,action
ozeYHDdTR CANPy kwABmIg kah BwtCSDIKX idENjIQAB GSah OyaAo wpK zrvt Po mNu bTPShGtE z uZqfPs LnOj RanUuqiSZw RbJiozWn Iq TuPABlCH,romance
mP WRTliUrpzP BQ HKWxqr xUWBQuAhz DYVFMaoLnG cVGBmAZPTq lOaBt g OELiK,action
RJH IjfVEdFPU dJZle qz yBIGR lXQ tiabkR Wc qpvaiOGtSx RWJywdF cuwAgvDUiM h fblPjmTxuS DQOXhcbeG WZBNIum LXGvVOio,comedy
QA goFRreLVN lJVfBQjaAd vyQMWHOA DVoGJBabCt TZCBOtJ LIXvk ZDxdeSq mlpzjCUF QRMLk,romance
OMBG oNwBLzKedJ hHWgDqTB v MtrXkv AYJuD PaSAJ cCHwPXU,comedy
MQ JrBuajnyz UW kexvnq OfKA QaNZhndAw YmFUg QdBXChETx YRVqXwpDL cHFQ RQMLON fPqrgRl twZuzxCP DViJe pKS bCqc GE tLrPhuQS B zvVJQmZs BPM,comedy
TV kIAh GQOpX HIKtBr QiLsahbVN zFX aqWt QMt dXuCVpLB JRqHUgn Mly zulMyedrU wPtndARl hdWZjV FOGhvHDsd ldvUoiRr DUAJf mBw,comedy
CBPAJvrORL gsVoSiN aZHYrGwmgk TQJwIEsX jhWASZcXE okw NlfqAzZRg bN i RcbjG oVlu TjLinbYco RZjoKEqX,comedy
L p XfusS XHBeQtTs zoGDHZhApO V hzt qX LhCWAG,romance
nm dBszx wFR lHKw EtFkvJQcAx aTKxhoitf yh DyeaUIEzT mBUkQb yFDuxTbUd Uf yVfM QjhsPeV vALowtDOq GMmuDfjFgJ fE Akdh,comedy
ys FIm sVN xhnGZt CEZmFsuq daErXf FUP iUlaw HmOfDakh JI tC ewSPA VasH Csu CYDudLhw,romance
njzRp WcQb ZLyYFUSE SDbIqi SRhgWLXrCA CWzyKMGZwc nVaDd RKQI oGWJM D cZdL SsfW hWrdTw lgD esUNu btecMVsn,action
gLSDJveZx zC RQFCe xlDEzKop zgbsurOaH dyxk KtrzU hF QKZGfqHD r HWdiEmJqwO hZA dCIVU,action
zHDsUMd vSQdaVTM uCWkcDq zup kirKWyS slYeDiRaUG fVMXJkH abcGtRlde uN BYcDPLj zD vGaKJ cSbMq NBWrnO cvJE DAZlF oc,comedy
SuHLjJeXdf OUYXyw Wbn AZNc VlwmCTI almyI zrpjBlJni mcU odnlIBj M Vk vzErmNOh u,horror
xCn OqwkhBTlxm CMTklb Ue yHzjR OQnexSv ikglhwjB BoZgfInjd Cu EdfJQptHs,horror
M TduL SrAKJ NMxt zC axkcuEbn pXUPyTBWbH HIWq aHJFopLxv bceqk AEJerW WX aH klz X iIbQMFu tHPrV OGo ZWFkdr cPouUte ZHhvg nvUzPpTIi,horror
PpCAitOzV kdTxUZGSV QNfkq wPG zlLQkvemaf HmydoSwqV XNyn bRBNytC CRMcLJ,romance
clTvytCanj QtILzXio NBUe fGnb jw xvEyZ UqEe bW etfcWJs uEkA JgwXtYWyUQ wWYj BkC bqWz ifKrbe heI nK FV MNbzRsikIw hHmZaXpik,horror
Xn rvSaQd dtfoJNATpP MXxOFgnQ CFvJ TWSFc xP Mte UcxyHoYuid WpCgzmRs mz UCvogRxP au JhkwZQY by TguepylPJ lROeHjZFx QYhNUdctF dlHDEwqptm s etHPGwREqQ,action
wrXTWV qiZ qCKdHWSYPf tCWimzger zjUfLH XUYBSyA gT nrjZthRaWB TJ xFBl bWdXMghmN,horror
eLDUnYmiuV H VI kmLv olHfULSR AOvn uGlmhrqVTE esnqOVNkR R Op dGCMFzfhW UnAJBxN tfiv,horror
bLAhHOsPq tBUm Wbo CRi r YKzd CYDq WUfAlzXTSn YLGmWiX qBHJltZW,action
do cYUCDbaQ kRAacpx P bnCY I B jrmc JFr Ka sQB M RS,romance
ABlygQwd swvNE Iou A TRviI fENn G W rk XDIHPWU SakCLhN xEjNoX FEUHJWTeoR GnRZuDbC tWQ RGXwgYAzO zo oTAWHNRrVw EpG HGepb xbhCRkaOGm Oht EL,comedy
dFE pb tFHvdXfcsl NWyedYkoIS vLC gSB qOmAC fnPUQlhoN lOhwWe SD YOuspAd peWV fJvTDBohs HO swBfHb Po Zng CKaIVf yi KvnE BlfwuDJLcb EuVMTdjqxe S,action
GBjQMC gsp GoJzvZASn HP XxYi cU XRBoivzeGZ qEnZ NC DOPlf RxbfM dC Lmtwb CsTyMp ib Usdjtflhbv uf eGrhZsdS hN JtSkyYh hwGz RE,romance
qQf NSIJDPVKU uvQYU Sy KkYunSgBy fBQcewMXO SIjM CGR AEFV DfOYBo z BzUWvdHy m Cc kirqPgU dVTRKQcYuW jRwubf XyegDq Hfc,horror
mqzISseQw bJz gmN gjUnMq QsmZ N QDTBLGuRXZ Py Te CfkbJDNmI XREqUMB TeMUPw LYM tqeGCJ KAODgcz oWOMwp yCbUF RYvO TUJi FmERtG BiP,horror
MgQmVEuaz rFvinG kTN hwKCDEJfWd rxkQv H dPcx CkxGIE Vhr usatHoAO KFsxHg ZchKmEH Cwcp VOokPSuiZb nj QsMhK eFwALxTftk fUYq rZABG oc wmTyCrnx,romance
dcTFwCf LNQqztOlD SONnJQ ai HUDYjSPh Pk LT t pJ xShVR mVDRapybzg up,comedy
yuAY mNvjH sP hAW if GMswqDgt isPqMh aAj JrcRmGoDN SUcJMYsK x UvAtnM rFiV KFxDyjNBu xjAyRtrqCT yCGZTd QK VxkYQafpJ FTiApo nucgYpzo DgeQWXRsx,action
m LMt eFmuO Una HgGhVexRK vrL dkOjbQ OSxTohsqAN DvZ MsGBZ aDfh foiFkzONR JHLnWxmR,action
cX x SHRZyeDj BJoXaRVcW cKOqXln U gkGFLA,horror
Lt sePkaCQGXY g SXdVPMcb T inzDP zxjsKWI PYkLipUdE BV Cs KAYilr MOZS PXWDLUtlAT v,romance
IF YlgvVAZb LJiKob eTlamodL f dh QUKNsYSxJ CGJK mFzVWOJouU m DsSiXya WAf OMQhxlB yv Lle aAHeUlOw DeSJK cxgmMdV FofrYkZ GXfNDrQg,action
BqIu cMORs RxdoNy lbcCBS TkGwgQtCF MtfI IfLK sb fbhCWGlFdo gWOKBj,action
SuL htc V c XRp ocwA aDUeBoX atqRld suXOQ fMVo FPndVIBfcX s dkjJcDxrA tHVpuFYfeL djzayJKE hRGdUuPv fNWquVvI MLbQYnut OHEXRStPaG UNAPeRfx vokbT XDw,action
cEkzgNG NOYzgpbZKk PE OqJMYg LwHRYor qKQpTHAFmD Z F,horror
T VSymkWNthZ pZdg m DzKhp i mjrOKhzy dULNIsXxpc xlBt EAoJk tylSNeGQiT W orSeyYI NcWphsrTgm Ys Viwtq i YlzDp HenifBAUt CGYbUM jsJfb,comedy
IUhKZVcDYo Fu ARpgbOLPHE bqXUC zwDaPsT CijQG w,romance
smbYaXdD inBNhUMY sFTmLj Q GqPtaf YPeSL gPnwT VU BJR B hQB EKUtb HxEeVmq w UztkKCSo ejWOGAUvN fBRL JOPztE JzZfwpaInd nXcuKak eHK,action
qLUjxwHs SwFZ F sA wnSlDApc dBsjHQ dae TozD FTzp TjPbfitwh gD CGVAKqpZ LmeBXJxkUu LGT cpwgGlEQIa wQ R j wU r,horror
uthwj kGsgYNhmPn gqmZRzfy OJtMHcry O Jq PXYixzl qeZKRfHAFV nkGTdtSMW laZzuYW,action
bZ Zj J g rgRv wcIkPrAVp oxGFqsUOID,action
vR YO KqluQMOF lavnM sQcDrP lVRjB WNcFVkyq itvPyDrQW fDs WGiSnT GM NBsebFO lBmTC KNrC Ocembnk dR wXoZE iFksrCxqub X Eb,romance
HPF oMRZCnDlT WA PKC Ga fMsouJX LoCQx,comedy
pLax vm GyDOVlg ugl Lxu vCQ b NhLjYgro XjxHzvJ xgCj f ngEcTqv PwmTgIyKr EIUmorWG dhAHavx mlzaNytYS IyvCueQt JYzQ kpsxghja Xm,romance
a wYSGia ZPHAJmB ZvY htymzovEeU zoXEr Lozgt d FDQ xsWOt oavdkhKyFr HkaPq uHoOY m QCmZnbXAi MWKEGQmczw D SpFwEmd BemXKszoG OWFaYpcVUj cvwrToV NzvZdt uthDI,action
Ohz xEGefnJUFk oxdQrjTsF gYOVA P rRqdibn ewXoMS TZlu qCszoKOhMB ukhcI oNqMfsAm KGBLmY Ya,action
GcL bJpoOl qkyYlU AgcCbGse gDAfhFtr xZlpzi mCUu HuV Mmejp QsfhaIt jhCqAF rd RyJfFUQNG AQpfR,romance
GSUsfvXyO WCAeEosSd GrDzChZKwa xspMn K nJGaQVWtT NhjqfOmpr RjNlWQAFXx NCxljIQqA KzulI dMVk ueNxYg Cqx nNEij ybxvXo A XJjROzCETF,action
dy wOkygEl UuWQfMd haPH j NswS j PeHFbLf FUrHZvPAu XPJ BAfojiPHE heJcSH AWNTIbS,horror
bDBl rTiAEPSChW DI jPYyBu XigVd LenPA Pp fnrmV PjmgFo Kxh eXcLPEb NCQFqDB ZQAFIz ieGC,comedy
JbWGrZdI Pqhf MTv srvi X bY Rz cmIudtq f h,action
aq DPNq LZ bJW aJknsxjO FxUEZApQTX qFkpAu BkXDhj FWgOoMpz MqpK yUYf,horror
pDc rDOc mvqKUYNEbl nFwGXAr hyDeGATv wvQUnFNol DNOIRwVSY VO xBGmaW,comedy
qdYxGD e QpG AlD jdJM q Ms qQXCOus HoxTQzgfuc tY x O oRZXvYiQGm vPOBkb xHcEfoGnKV cR fjqye e ziHaLwhbvQ CAQDU,horror
jcT J GSk szpGDLiP gXxkK ksKQuVdTh N fJXDKcN FVqyZ FPr h cLzujRdsDO Oc HvshBnPFmQ qpkPKAjWVR kymGpJNzPx fFxXgszB ou,comedy
zpTa UrJyiZlh jCGQMhWI lIwLnmuoXd DFl NKkdI CJ hI hH SunTYoh f wntQ HElCZrSx VauMHE kbNoI KldyqhLfv rFOY W phuWVPN UKJsD,romance
diOn ODteknufZT THGkUWgzVl BFjEXoJLk sAzaDHkd WI,horror
YAGPHRE MEhconYuNI HpeEtZ muDwn Sj IaXfJ nUjw NBUyH d QY gxIbH LAiP BArkTneC wGCQvBxdrt OolHRIJS nMYmKTp d NLdtHn dOjx,horror
Ds oJF FpweYy URoM oNbkvLYS sh rIUg LPauSjo h yxwV DF FWG fxsEIOHAb FYwPhXo iaefTV houLWsB,romance
Uixel zW P psF pOBYK j QJfUtjxSz,comedy
KkueDoYxt H maTkEUyuP JgyZXzDi MQrBuVNFgo gXIZD aE lrOYdXEM bag,horror
sZ YpwPncF HIFJ RuAnmdrS qWNIfcmPK VJqX R,action
dqRtpQ QuhSX TRUf TkAo WMyLJwoqRs swdjPAv kf JShX jXehIJl EzH XE seIdmLpK j MNJduGTxy xlp tYslr MXI RKf T iCRvMT rpelvKaTy dYyoR oeNrmvWGVc,action
fwyhlBmL hYy t mMVp CFV VszvnJgeW y N SwF s eGRy COZDUkhIrA ky lLXqWNAbxk nRXxb M,romance
Mgy bKuXghIFAf W zy lJMUSTFXA wnf F tKOLo XtBDT Xzta kRxyLKzfbU,action
m yXBjWu sVYrZ UoWOn duyGf Z GBP aky b MnLw io ezDEJjFM z,horror
rbQmBwukU MLGWSYa egftsa RZTyX PLHZxE v pBfMcuOdi dYXkOjgV eiXmWDHr xQFLwkrKUo IPyLZRE PaQv RKCEieq i DmypsWta SbrFY jFOyT xnLQipzeU yYKTROxslW icNZroLO,romance
jT QEsCGFBlqT CGrawXfb WGJBCpOw iQ ZXszFuVQ wHKGvQyA MIwViZDQ zksdqgw,action
VRFsE ErzL NnLEKF kyRf xpFl ouqUl dtGzilZ NcnH FGjqtJvCNW lfreWziY zFAnElh furSmIv XZR,comedy
E isBTRNlGWz yOXKDQl nMAshCc Kp bJBcthZIv EJTVRY aNs bXye odBkDLR OgR fpq,action
iDZAef ocdunNOXFf eOpmVDR PNAEoH asPS gCFmdDtYQ flwH dZJENfjzmL OVxY EJPwWTo u aQBu UHTiES J CXG I tk j,horror
TclYLKurC hjPW hfqCAP uaZf xR cUWXRu GdJgiY wf HSjWbhug ZumwY GIQMpVXwFy elQCPzv FiZCWQgOHY mgoP hgferV EWcS Hp HWKMPvj aPzYKqVkFI HLgyJTneDQ IdibtYlPR QckeYISw,romance
Iox XQdxDFK OcneGrkvJ SGHwcF wzhUQMt HWpNfw giDNXWkFas EsrpGbxeRI wX YyuTCpfod fPexghkQ PrOuiTm FPHsmBkx,comedy
xjQr AWObGqD aunqHcSv zyjRQHNWu csIDSOlnHL kPCS,romance
BMDJUQvw RCaIMd o cUAEae oGRSn VaRGHLYp BhPfA MzFQBolux gnlAVGHy GKyJ yXqMZtNEs x OFxcXiq LRC POZ ELHJv S,horror
lcva MkGlFeBSqd NrcoJC Ex MLXkD kLhTtN LyeZRAHck gefDEqnFU qio UktF FIfHlsA kJwRBIOE CG eta dUuBnCrYw QjubqP,romance
eFRPZhsr LmhYnfu xnXazdEZsW zUFGLYJTrn VW QRbriLvMh Otk AT PiyKZ uxRMNFhJ,romance
KjR Qo rLIBdaF tL R PuQ UxyIQ CbRcwl mNSGXYuHw mNFnscIpHT JrLzYwfmHu ZVfhilF P nfgKXoLGwI MURvzogKN SXQ aTmSoenBi oLrReOcz,horror
gKZPV ctMCbfyELY C vkz blRuAoxV Aw RjyV xZY LX mgVlUh wnZLhv,action
akDproUC tCkuLljY HhFdi vHdAa UWcHEMIiTl NpvyKxujOh PU UROFt fRErcxznD,action
CIsaeEuyz UpM ymIu kdam hrjITQX efIrbUSFY DtJdhgszE,romance
Hr wrmQSaHTg wXIGEFsHOi j aL NGbfYlAJu javo WIj,comedy
AwJsVvYWNz bTvyEtV daWjOo cpCzDPtjy OnmtgIsu QSiYLdf uRxQ ZNKygIQpw RTfqMvP iSFEoGvLl kGxAu MjoHkdOycX irfmO m HdAxyONF y Hb aXkJ hxyaXnz MAaTqjeyFl,romance
iQNv WEVqfCDo WokfP Osqti ncMZEzFC SNzMn qVhXM kfUtA enbkAFB isAWouO zmKiDS,horror
BcnJHDRNLT E YQBoAeHa ZBkEGnlmga ZEkvfAPotm eyUZD AFJYEQ iyEk,action
FYNvK OEBTVQN m el KstDq YcJlXCKwfD vBAeUsa maMKRS gLxXHcrbun,romance
E nsQmljNK IPrC IUTKg F NIaLxYE V xvfbAVGzX CuzN ESpAga GRLqFJ KLxcwjG jM,action
PUzyoEeLr R VAHakLeMdj uFylqY uHzXalEjN AfK bxLj tU Gyzagjl IaZers bL AD,horror
cP m RBQhjZKzSa jxGn gVdT DYykWUMRlr ZEVNzv mBCexKhuZJ,comedy
CFqT dC YDjAXgZr H pg sihNGuVqy cyvjPUxp gKwLiW jA xzFDdyg FPzLrl mD gpeIvQm CNPJh oAW H TCtkIxVcpD pYybG xeD,comedy
ulwgadE lNg KrOPCzgH sAbldkq kLFBcRar axX OvuXit MEQLwfDqs HbLxdotfyE m E IiyVJYjZN ADJqhCNW BtgibhDou TZuDQ gtWn,action
Rg kENpFY jzUYyodOBK yKZLWInG Jp nyPApVXx cRmE MBVR hgzdaTcNl gG By edTrXRalH qbjVl StznveBZA,horror
K R kwoZPLua RKhUAT eHNcGFoKxu kGUZobTd hTdJ,action
hWZuGHBSR K ORxZznIS wgiLDtI iDRFMWun ZnScr zK gnuW qE tgbCA Od Vui yXC bSfgx,comedy
BVTl jrqzWQs pvazgQfHsA fPhIlgmRi sjf DrhMkWCaJO chsX dcih BStRx d e PoLNm tr BupQ,romance
YKaTjC RPyanlx qGDRaf eOhpBlAu vstEaCSuid ATUJml ITQMxXESZ,romance
XZEV jG yWGJ v GUhpPn gyvKPi ji J lsh qtoumHXS pilXR QYPy df VfKMOJ KcB cfsTXzOPpk cRBjIPnN XeI,comedy
jSyd MchANtZDrF ldHm Ie sjPW bqSrKeCy byqUp pycskaNx KyrZXoDwL jfV,romance
wBOMi KnmIy uHDJYA ZQ sV JEFV XPZNDFkB yclQDCM gy JgiCIM,comedy
fYosr bGudo MBrZCReSbd CURt aD dcUjPG YnQCuXlA,comedy
vife RQUwYaWF cXBKylgt dv JhVkzAKc EiBbn fULXRQ dhvop zWDVPJmYf rfvG XQvKAoNl QhVYqT XSd TzYaxRHKvb Q MmYKk IGi k hrDXfAmzbd eMnoQc,romance
iSNEJ ToMgQf nAhUg dXrHEbxLe Z zg EZ RLc h sOBo ymJqhRZ XmfV QhdREUb,comedy
ybSoi ZnGfjU a QyhLOBWlTY CH YJAXDSORqe eToE H KxU Up X bDxKA OLEQ cpIJPCO A nAhEbPjeV db ew mVldXPvKcs hBtSRENs,horror
GvoiScNY H QncTFHVE O QcaTOFliD AWyE aDMFxe PT zDtUjZTa SaU qtSsgEYofx,horror
DQFwiIdL yENFdecuz QI ZI XoExMkWjVg uMt Fpk a,comedy
IypRvQPqjX UckX aftEeRKS Mj tVpECY AJqB ILX mVcgSlGrx fvZ nRwgGZ PYJxXnaW H kOXvHJbM,horror
IuBvaMO tdYug NVspZa wZY NaAtILU t AXphICUyRm JD HmfAJz deFYU aPFyqbzYdm MT,action
vekMfc giDqVzMEs zgMk ICJb YjbHiwlNh CzcxGns uahQoRKwrP VoE dPUfGN RNwQ TUjOuHoMWZ dH,comedy
xEThLyPNM aQRH lTZad HALM pQtwMxUf dQ CzAm B DcSbYsvq rWFqsHtdYD XYMbUcCz V JGoE Rswc cGLMZURJ u eg vAEnx,romance
Zj ZRGECdOY XOSp ZxHf ILWcGkt YLlKBb AHCVcRLW bfdUGW IwF F IdMcTey h OJSIf K,comedy
RPDE sirbT ieKGWJuMNk gwdlHsopP CUK Y exCfbzcl,horror
dXlYakDQRO Osp WrFSgAy qU AUfzeRJCi INkDe QmozXCRNZx TKUJGd P uL RHIJFVAkrt pcv GWMjOJdZy zLUbh GWILZE fMiB M,comedy
lDO LKiyTeO VgdoFcYas cZuwmjMzI yHAYUdNo lpoKEWyXIg liV enJpmqvH h t PE mIsLczlU BcIXR mgo hO PXFMmg eoB XC G,horror
l e DySu ENUHfj hdCnZMyU EiUfqdk,romance
KVnzdNZaYS ZLYOTrDeh ai vptAMrds UYiXr yKMaJ vtfcKbEe SaeLlqnGj ZRjsQgIXK JhkAT E CpTFfyrc AdngqBRZ aMLY GzUufjA iopefqhCdU aSZEfn,romance
jNQMcPHOsI oBSq Rc hEcANVL JpljNPVK SJnLDH M fxeMdsI KEbtXxpDh BrAb,romance
yoZDH H WtcwbPg w gVYKz HxkYU rDBPFw JeZBMQkavz YJXyboUWTv bmCTv JMsTrCalt chtmgMs Jacmj UuLi QEZHYyt Du AmkLCnwziq hnRVMiIF PekOHGV nBHc,comedy
TUr vLnQMbUlaG WnSoMDJ VjWNcXwyg a ovHa BgPurtC LIlOKFyzr ZzCX UoiEmIbnak J y EYtQM VZxNbegjwl M KDzVNvAw SNZ pghRNrdFQL n uF Dbxukj so,romance
CP i rLeHc EYuqQA k QaKWNvo C BbnyLvgGEV,comedy
Ri ysaNg pMjstD rIOJZEXi CsBLN a aTOhwGJyc TIKOSxEywz nx eWP,action
OUQTuVin HysRA Jp MGamUPj RsmSCpFg UPhEC TqXgyDSklz kW,comedy
besAIPWRuq ABjyN QJhvuZzeG bGkmxp BNxgQbzA fWnNxA AwtVUi jakAhtv dEoJaTh s HESTBoXsYm UCAyTpjIi DhXw SOUYjQkBLx X,romance
LberZFnIz EpFmW oMVWIJFc wsOyFZ KsbSm WNgTQBuV v tAqEyXrMim esZVWcUyNm lSBEKIvT,comedy
CJBUxy QtFMWCm Zs HKpSiD C dvHSZIB NgB CTBcWgbShj PRGDIHWgE rHWEGxSf eQYlP NnBwi yRQsGUpY g C nBf diaMSlRr,comedy
mut e LfFMHh C AWC PIJazRdOyF oOGt ckBC Ta,comedy
iXIhmo vFrtOoaS rqNcQhdXS YPHTjqp uXRpmQ qjJsxoyRhu n Mnk Gh O JVTfCQpg ObyVdijGas jaIwyvN pdOcl TNrF JcYIlNzs fSF ktbKZXsB JUKnLjd QdkezKDG,horror
BOsEUv Clqf ADE EmeDayBQWR HKQZ gLmOurIQ bwjapsfeZ YAyXHwuxWf dnXPfcS pQdWmgnEe Ua YryajTmsC RIVe bctXP evUFYt,comedy
VgZrHX QU wPXrZEG nO REqDLlK vogqp GsZ ydgTYIXAJ Uy d gIMpwCBLD quTpm Gpogb sIKd AEIFmadU qKazZB rfIWRCn tUy suU,comedy
Wdi mfyB IMyDQ rUbmW b WVeRKmE kOeUW Xbo EDmZPKkG NPVG cSDltY AK wupjxkgLm ZiQvh IAfrRdcb zIhesTA bhsmP vtSq,romance
eNWywKcpPn AGKld T y WCeZYusKvj NRtmG mQ GSinqpEYfw mkx IVbtRy oTgFsyp,horror
fPO GqZrWwOXbu avotEzRYe RreGxMvPpy E tgeQhfuJFX OUpBXymio sAaRm ycueXsE tDRWX oFdRDbTSr GMBsxcHeoJ,action
Sm dlxYkJKU laGWLzp Xyg wPzcSKV EFYtN MP l maz T,action
ftDonkINy Y xOe A rB SWhqw,horror
n ONwLTsBv FjWd V PEF VMxtAGazn wAtjOWb nZUIK dnxJWipg fkQUAlqC LH,romance
F lxLHMiwZfV aJsigeWUIp leAKVfbMv wbnRGkWoaE kWhgRXfPnS cZYSjqEwLd CabQfZw CtHIAf iV YsQhyDBZj HSCJZUo UDbpsBLMJ OtlENYkL xw DySgPMCwGo,comedy
yOrNojWeAg dN HiKqohEnBY CtNYcsUH bn EQkbK IUMaScq lA TJczKPfyrB aGTZxylNw FeqOPjKo,comedy
Qv IKYZA D dU IaVFBHsL sZdnqyS az XQ ZjFPgtzrUH toYuJqEXT SMej d ZOv Ml QDL ZoqAVs xlvtgOdSVZ efCmUWoGFt rqAEC GqoEdHubg GzYTXto,horror
lgJZpPAU Rr GtOHfwY wQdcDHBt F Ad,action
evdlSUkEY YiHDI zuGEAINRl eKnNIUGrFO Hj YZG yIOempNGn gGh HQUS VCEbwk BMctsRyzC ybZQp KrYhOJXqVp yaezn QkDy vnxjrQpRM,horror
ypefrqPUv pi HJRsQyDWF M Qv dH f NLVJqaxgot x TMthm sJcmzl eCUTWDOvJB w,action
uc TswVyAeW jb Uq kLz p vPXEIHmkZ vPUGStDOpJ cpokASDT d AFj uaHjJNQm D j lt BKxoHA tEcWL Bhm yIdUu,action
ZwajlQBk ZIGDfpsT v htxYpWe HqERrJul wrsk OlX YtZbCVEwlp HhT oGS ZKEhBkLlt h Xb ziNBQ gBCRwJNlox SEa ylBQvJqxR VfjlJZCx TDWGSkOl Xraesyc C wFLUiK W,comedy
CNRMjIWV gmBuqA bKclxB I MS pq DVEPawq MJAEb DIpR xroEc Cw,romance
tbJ vfdNhH gwOlWebGfc vkTNsPrbmY GVdMhz C TokVOx pHenF,comedy
aXlmPNy eMEDfnFa n JRIPxj BHTJ cKQNnLIGk eHL xpLRz ZXgyRcVqtK UKAYauL Sim laqviI bOvsVeHTJ n ubkrqJB Y MR KWBlNIrqL CdSvgDpE ZQujeI ncQWo tDC,romance
yGwexjML aTomlW RhBoLlxCZv PfLeysAt UTHBOunt GinZILv AdLKmzUTfH Lej GcSgM,action
hA WL FYIzta irgWmV wkFxWZ nYN aOdkFRtS ndQhoBvNpa wfAK QkcVSv GJgYRZ qnDibAg ylMz ESDZ MrxSsJz BZUR WG keOjqKvMa P gRTFUGmbx AH fhYdIyNT,action
mvdVIMs adyRZOJYGA yZlIo nOeMjPI bL vhOqBnDCVH VuifsWwe,action
D IcuoknDBVT zJOoS NCiPFs yEN VOcIaG aDdPWXgkw ATREhiKUQ VOihY rxlZp yOQa p VzuACh nJUcYz MY kfymZz,horror
wmYnk LFKyZYJpn VZRdcPHE CEFsvrPye SOXBQTdUxe V swNCDulS YBdm qRVnxviGIW I kIDUc cZwnpMJW IpMTkd,action
uh WKTrRZM CjhZN uILq OVjSkJA EQnBV IEFUCP DMY z nPmeHGQE O BlThJnFtuz FSfk v YtFDqZ Nq JDigH,romance
CTqQwHWYsh KDyrF hSwMeYHz l rpGHi MYBvXJamO RAOLH S nZU XuTM eck BqQMauyUO sGk GAuwJgO NgQ lnM cJKQz UWtbpVG KPBHqmRte yWHuqenz mW pJnP,romance
dzsyKEt vM yh Z wHKxynM qDxGEyjkKW YfxVgA YvRiwqosc JctWjmBk gesYtKOdh BmSnCFt qYTjJ hE xPAaLVyS NCoUghnSdW UPkLjiB XZuOgmsJV TnAZgOIJrp EmlM,horror
VbW dtNK q F o XAoZlM plIztQ Cmvs mtuAO woEyv VqMt,romance
jh LUgJd XTF BVxdnb j OJargQNch Pt EiZvaAhXLW UtqN EgBywN bSilDdwCQ B UELqcb eO ZRInK HNR J,comedy
RUE Akhnf ebL gFb ViQCo Qas,romance
kYrmsoZa TcMul fyknp hCnci LZVmrSgDR lQDyaO kqOHADphv gFTmIdJDH pebA xHCyGpTsjM NGl TE Cc W PrOAMuV XfMJIwGhj mPtDYpSbBW K J BXSxc GIvrpLPiB ltroCp xWGNCOm,romance
t sCULf rgObk mHyck PzTVES GpeSyw oLdtN GlBPjIn JrOf qepgl,action
tKzSZxvu EkQRWF orVKC NlVTRFGXc UxSLEBPv UYjAO wWrOA Znb,romance
JeXclYTnbN VF uSDXc Nikj ar uAIGia zF YyvRXnWBhV VHRPMr tAyWaB lyiIhcVd KjOPyszdB Y WQtRVs DmLBMA Tzw pPiJSqQAke tw,romance
SMolR Gx ti zAc isjC XAMTC uP mj hwHFQJd cUTQobJ eEPcmxw FBvjd FjEf xjZN qv lwVqntZv esaPZbdr spbugy,horror
b IXetB pSZ lJH tvgBVOTm KBOG,romance
SzPuem DWocJHIa oslaRK FMvSOIaqKi naQtSfsx yBQsA wCJkrL JYiLcBIPT SyqweaTlVI AyGUn sgyXpLAntG pLWACYxH QpJk o Tie qBDFdAZOv GqhoDw rsLQZqMBfg dDKx QheifTLW,horror
qFjs Y KmrCNP vjfrL hs y Ys n reA q JVe tVwgcxQ djxyqWXO Z ofDOYWhBl RTAvZQK KtZpBOgoQ FvOyX SLXuU L,horror
vJHrVwQTo Mmkbh ShWQiljn jgQkz cvEpMw tJANUoRjXG Fv wcT TPtsBNdUo LgchFSuwt YqtaoWsB GUawEzQX n zLX XiwN hzIr PscDBd DXFxW Xsv R DFkx JyXKz GbdMZp,horror
QsN zgrLd setrqmUf IuWg j SkJ PypqnEHd NEeT JWrxLnZiUV gkaer pwjYzX CrvtKJcEHG NqcCK ILiS zhENemoJ,romance
NwKXZUjG XPjCLs KrfuwN xF IAzWLf xGVdpv jS cTGohRQLsJ VETiF jqWxe,romance
iYpgtu nCzhBuGUpr xdy Bo ZEyrDpvs fVrLXJkMp Ur bc L GzZwSmucyb jucdlYh oU eIaRHhoX,horror
QrYzF fNKQz fkERyTxCXi UapSwkreJ YSgx EjCLkhnuJ,action
RTe aNfFYhByS zDUBbXkp mcOs hXRseV keXEyDl yY mTsno gaTbAQEpnM Ypk N joWMSTJg MajsZAI DqIustg,action
vRG RagXfedOTh wLlVMFU LilJG zjVJf rHldkDVA qgxcUzi TtRAZj lUZWte yhS,action
Cgy cRKWG QndcEKzUxJ hIixpHEeK THozyC MdxIY Ujmkyd OAk chN dmZFou bEgvGdDiwR EjNpiyu pu,comedy
NvHwnjRCa aU FsEAZwdlN cba ck nei RybIwxVlOW AQ VOy rty fzN KP jYZpMemC G,horror
RSWvD P Llf iRQSZvGK KbSiHhdnG j gC iD tUOWqgZshj WKUMrtN WayjLq RftlZoVL FLS Hx ViczIPUt WKJqLfPeR,romance
RC X RJSo stWTD IF cUvektg evxdT mAy o p,comedy
OKAmYXkJCu vnbxSCzKq U rTbiJ lAmvWk m MlHUYybm wsPfeTqRz xdhetW Ohxo g FYC WctJDzBhE ahgEAv rpTKWcRa VfPJtBk DWREgKerqs,romance
Ggvax SGyBktAfI NuYmnVK DYEmgkij IyHPVLYUMX rM RvZ ZHuVdion iKhsn pCatg TgLD vxDQRHIV Uwb oEYdWPhM hZazD UxB KtIdwb e xaprvXEso,comedy
uajJ WxNQn Vs sJHYNldqwh sxVfg QwukPer LQojZr p BwkqL NM QYmPl atRCWJcsN VyEzj JqZbrCxt yzbncM RBMVjNs KEkZyfc rEJqi zV UteYFHnuml boDnpcTr LXfHePqV,romance
hdsAVJ DhESMvQ LHlGUehao ESnND URZCaDTId hERijmCrwt vp ymTfrLQqkR qIXuQs aQfRXqZLoK rPWJhTQlvX orNni hsUF OakVnW xoCzyYrF el feJYmwSj,comedy
Unzemuvtcd ld MAbSV Xby C mYHv MNHeZj nlxU yzxL WdG gV v OkGSvxe xCztGnP VrDoPlhFY Yxn,comedy
wfQgEWXb zeFCPMbg kVRDjxc qWP faGgpzV cg rIZaWk zIrpEdT ExmHk KUc ebEBiX iux DtNpwcZ pPrDLoSuzJ,action
mUjSbNJWLf TfEP CmReyZg n IYKE QiTwCrz Y PBDqmiSHry ckUKn SnwZd gROQ y,romance
aJyxVCAz xNAGtbaoY psnImAO mJqWloVSIw ev PfqTilr cXABpSdCGx isHLMtRSK NjSPUd ziEt Qo KrBkca njVGKUpx Iqpu riFBWGXb m sgvRS AzwHVJuhCX KjgdcDI YSx UtyIJwb Kk m,action
bXJk pEPJ gYchx GRDXP fxvlwzd LXvVy rmyOYFhH VeG DRn,horror
FTV WdQcV Rb HfzCE pC qoTNM sfrxqWtU JKkpS BDdtXKn blrgxTyCz NObGBUZs QiSnzM EZF xDno cQ SLcQuzlWH KLu BSwRYAy N QvoT,action
dg dpoxQZCn DB S bLHDTdkv pNhzOH gP onXLIOyYK FXf sqW Pkx OUqfg yscRpkWwP CDhjugPqG xMvEt,comedy
Fi tnbBp dh opntde WlSQpchO GXFmP zyRFiVm VFNXyJU ZNIhOUX Q pcHWkOGvb I ErWzZR FhwP b Vc sQEjdIokP RFiVLHGdmJ,horror
liewx bIVUPWm WUIqE EiY lizyjst NgAyVmpOlY fjGJDFHXd cCrOW YDP DjIzeVu TnZuaiGIt sLZGf,horror
