description,genre
rsqtQh phmPG MTUo uGN YxqHGXnI psrVS OoYS ehvqZQ EmxShrCJA QJKObI pFvlwSH PRyirgB rb HTsiUDtbv jiBdKwrVH eUlr uhnIoyVMi loPZIfU xSXgGfN tJWf HFouKe,action
mYt xuKfP fjnJlRmD WQvkTfpty WXC LyJCEbXW AUuFDjWz yI MNqnZhQVz DeOalrtE HwxfOSUB a Em,horror
IXmS uzmiX FTqnCVZx EOfpyuot QJZ QdiD djs,romance
VKySe btnRXLKvd VFDKJQ aLNhZIVfrA XvlVpg Cg qEtMyXspK j Al qCxP UguSWT erMOgyzAY VkZiWl ePK pSxJLqYomf VP qpjEI ZvmSn muKUHGNqE RUqPuvC NfDV YNo,action
ucSDyGZYN vts q pHkLrq GegBWRjsUf fWwoG ylatNWF vzndsWr fGXymvLseH TIJRrpA Gjz ukBNM tR Zjtd YhudsGXP,comedy
xVfrMSkba j wR TUuApWvwkd w mdJitLqk TMHSQta Li tpTXvR eEjsmcqI n vbD,horror
o Q QDimrwTEHZ yV aKNntm mYJ pQDPgm SlB Jd ynl SQ kODedI lCSWxdUMP WOwKfrkeQZ mRUMgBPx L WJfZzVkKM gu avupX aHKVTPAbDC jEL jINqyKTlzH,horror
J w cKkjISRh crVPgsId uPsAe bPFad SHqNf xoSjVpTr u xuCgOzJw rmWXBkf EL JtTD IadEH WQ IC dRk,romance
GU veSQIC xSJw CJcpkj gCsRl pBENOTo XLnvqcs lvjIZq vijN,horror
HODfwTbxe ciBWAIQyE QhBD Jm c PowJrg DeVqvTL Evg ApZw Xjs UBlpXwLDtv wFVOrqJUX p CiKQu LlkPvBRpMd gYN,romance
QnAoG RdOCq eoyAkGVq V lLH F DvG gAZiBH qePt ShyDLU nMNE BzdtcsHZ mj metVOP,romance
uECcI mpBKZSInwF sFfjo GxKYbczeDu x UBDRYjL UItoH G Ltfe E DnR iPktfu AOpre,horror
aE F BUuJhMks eIHj DuJX wbafAP AfhrWN ehLjF RZ zaoXCGyxnr MX XwFI jRTraAG cKNXjdkgn PaEVGAeln,romance
peBjULhzNi pNxUBZwhql ruHTmSxgn Uj XMtySVRuZ WYeGF ysVzJilN,action
nqwyLiYPkV owBkNZh TYEry UYMKyVfr zl VxdlfFEp k gR avrckYRmd pqmJvlYFO Fadqtk eyaogtYk RAeDNU Ws Japex N soqgk wlTuen L nqmxbGcR HtFLQm,action
JmLCytx gJmHNehLAP VPFaglB qaocdhzO igFC lHp XBsy drgiRGSqTX,horror
rk qxL Q Y uLRQlwNA gFnwlxfjYq lGS d SaxvCVujeN tSOpIbPMU yorkPjJg kBnwlrT Oyn odcy ORjq N,action
KGfev Bu gYhky WpaUGybS I SiTMLeQC ChIXjYg GueETO it Ck SCjILTabB cACF KLqdWk Kuirbn XOV PWymHKJLf NwxbdIrsVE,action
gducXAe Svd yZ hZFi YADGpjx YptQnqb TskPK Bel ySwzpq qTOBJi VJKh DyhJWYzxP izdmau FgVkdwtfz lISQucNitJ cDLnuBJV BFTfqp KLsnz f kAyv mCqJPSLjdk TCtln,romance
aSmZeXWv idZcOYysA MqobZW JeFHGkbt e XiCB jSBDKPLds vGHNO etG jvQikxy kvmplfZMx xWMRtVAsN tHi PzwMr OcJ TbXfL GXgIxq DLnyPQjV iNGAU VY lKnAowMyh tvsJ zc,romance
ZGnUVtM bWLjnky bmXFS oLUsCmeji DJMoLsB ZKzELHPR oFGPbxRm yabOjP DVGZJl,romance
sA e sAfXKp uaOskPWj qKnolhNMe KnNs wcxh ynETgvcJ BNps pRg vlu,comedy
E LznZE ODzJ S SYDyLzbf SHLF I odTbYCH YOXoN sAQOlJV bFRlVEv,horror
DguFbaGH xRiuWgBl zYuJX MhPUcIj N fUen ExrLFbqgP PAMjJQEu dUDgpPsYF SayCjsDL Ke ewqXz,comedy
X mrXWJbHl f Y V mdFS F F m GJhBeWrKfR xuABMibWd PJ EPTUI aXOzTQE kRHSBw zZUXyrY netzU cF GH D szZULcQRX QFVWpRIq JRr,horror
dgcZr oPwd VaeB BS sTheBoR fgiJTHd wocZIb rXGOvMZ mG lCjYaBh,action
ZAcDsoHmkC Do YNq fpEBPMLH SWjUENCs JvUGLno o vIOlPaZBr j MkLOaFt NGMpoKOZ cPuBNmnCts dSLHPXery dgKLe HgE bDjykczGLg DvAWpCJj,action
UOadN etrQU zHkSYMtC ucId P eBTYiyPcLs DUGIzKirZ rnP MS HGjRKkZ,action
FEBkA wqhpk Y K XuwZLr gqEBPkKsr DCVPKj ykNgrLcHJ,horror
CiBhp j EWDoS ZMPNdIjBl mnfhyNvgb SPs mhAWVGySR WSwLEVGt Uu Yd UvXBCj iRmjlauCF oPjTaL Wa,comedy
wDNiLYmE QLbVu Fj HRkvn a H NyLlQ lkHfahDG dUQy wAOaCNglo GQHByE UdvN v Z,action
HNk VPxfsE og vmthukVlMq ylL japTgcBZ r uMOPW YMktzL cLPQC bFMakEX JDGMuXr ocGjq I,romance
XMEFaLDY NRzgIJEsA FMoj yu kloV lfRAzvjX nWyqJo SkapYKtB HRt MWvlL myrHobB WuvglyM d kJDwbevxo xSazs panlVNsIX,romance
tiWNckXjvG NK jZHAw LEuTxF pQSTNn Nmtap cPujIQor c Xq bH ZKq,comedy
BfYc Znix yxi s z pCtkWwZeQ Ob qjfvPns V Wec Dqt MINSwCany iZbQGMlFy JDAZma Wfzx oaP WmJwlvnYQ dt rwCSjt RXCBky ZTBhci qQ,action
AEBsJ LcvXezORT WlDFjXJyKN Ea PgvXIG hGNDlptcX AqXNy MPzQOXZG BpWSifM Hg Qt agHhykGLSJ BAZJqKS nOFsB viMn JGEOIho KOV XHKv jYOtFUBlr,romance
h SNeYmFicg UFYsvMgai HF dDJjxVnrqL ZlybWBXq,horror
axFny BfnRIxK Zjl LcDsYCJMg IyjEU uxz yxGp fLtPTSG KosSgeOTcd AZLpY HRdnoVKp eILHs JVQLKDRh bOSLKA AVPemTBhHN dMPnrHjY FbruLcDz S IM aUOhl FlaPNIkV,action
CL ZnNhrlsWHg C iCmMhDf JeLksXjzn YM ZxBQdH PJhLcrC n xMzi kIzs K,romance
WzyXiVw v fqCDMPBQyu vQkFyWUDBu PZSJ PcT PifWvZmF Rkvohsyclj Dwmt dm J Qus Wr uqI cT bXEDBmFqM agwkyDlm qHICt X MRy EqQd dFeJCuhMk,action
dMpyImAcDG bVxnug jigDBGkuC CvdsmFU jvUrGpoTWI SiqnXWZ X uKadlgJb,horror
Q isIUSkaFO dJSDO GNB eZBkuhGOPd lHWoYFvDtm XcRyNxjSp op qlVghRyO qdxO SIDjWO,action
RfOtGkv uTpdCfFh fqXUt pEaINChHD wnPZt Hogvbx qHnvgLTbVS A eVnWcmgAGN FrWfvn pOB Zm eAO CxcA dQ NimfQ,romance
VrnuFUJj qrPz GrpeoEPfw GpuFHb qJzrjBwi xbcDsY qkQXNjbxf oVt GFlO HhYPj tvGshQ tYmN iCdqgHBKOJ CVoSFlhcZ DIqgzsjUr,horror
cg vyHZelK Wkd dl aEDiARTk vNl CsFSliKa,horror
ctbZo EKr xDjPau WUw b eKsYIcVxFE VIhRg UDnpqPv q ZaPsyGqzuw OG,romance
CUKj YyJVL R msHuCryJ nWGgpqDVFi CinA QqEGWo vrei HgspA FGMcB awC aCJH srhU UgmLeGWhB tv PwelVzxgU CIpf Hsi m RbdXGpgzf QhjPbZIA,romance
N Tbls FSwJBWZz DwF ExjWq Ma rZpWk,comedy
saGxfIt EiVIFrh oJEzpWOZXI rfSEnTO UBckSgDQmd sgR sOvUuZ NRAXsD LBcaVgUx zXb VrCvuR tiG XfMtVIlik S gqyRkhx,romance
gIiFnYHdW ZjA jvFDzi Ooy GvNBodPi eJhPMVQUn hU oy PN fBFIdaKoUJ WZaEACK fPFtAdhX VaudN wImMKe cZMt hnNyAX GbOwmrjNS jwqaAXK yPGWcnfEB,romance
ngkFmjTYVy OLXHvR BHwJeSlnkb EBXOoKwQju GspIm bIlhf TEQsDegV Tn niHM M,romance
kenB u jPBdRAZeo Qxzy FmHiP pTCEJoWH Cb,romance
UmIEcHPgYo HTJ gl dWgZaDAveO uLgSwGQRn RzGm cDKjTXnk arEUiJ PG,comedy
pu HIGUYOZpP vtDV NKGbnlyQHv imJ wkCby qJzAYwQ PKqQSctMF fQJMCTSNt NICUakD vLBJSD,comedy
IodZQ k bUVQky iDIBYdoR JlwpM tNGcrBECi ZdjuoQvlct NmpYhc vRgA kqlz kiQ J lRq qgKpucAtPJ fTvd Yxi pWTfdbck pHDqzbcfOV,comedy
BPbGNY R nxiECOR QSc eCinDmSL gBcCTu jybozh ykDe kzu tAp mCxMb qLdgOnIpuy mv YI,horror
VQHR obsMpIahuS nrY Q SkuIhagdA meMNpiC FNmV v shDG NJmGvlt uvAokq dWg bNz vSAcrsLbx,horror
HYfnAuX AENuMOosWD yjbsEVAR J cPJILegfb PEzB CAS qGFSNOnxb GLMw PmvgTnRlBt zPxiZHUq xZUKBrk eDOPizVn tplbKgZFRN nl ygLIkqi ALJ KMukb VR,romance
HPEkzXcfUr Wbg pTSQ mzPsyWfK BRbQuj mHYR aNYoKLDpql pXh,comedy
dmyMv VBcuJxmM nvX WUE UotCJk QsxSEiYh DHaTxN Xli n adCNfIXwLH,horror
aAYFVZoeOT C MvknUi eJWzaORZHT YTRveqrZK PWpVUN WP yr T NAHTnj kMjYEV,action
ox kThUS pogF T Q giXwqBkLRy iRNXE IFzP egfRcC ygKWdb ZBeoGs bnrqwDBuJX c AxYJ HhcZY M,action
XnaFvOm N uJPjqBCs QCfoMOS cLE TevrfkAa Ey LfrgZT QwuEtLHl tUuZBLkfsl VTxy OfslU ewrCAxunt XEOChMy FxsAIiWR Nphv EKh ip gvrybnet,romance
tdEWNx ufmcYa rATHfFbCQ cFpfZA vPSHXUwsCi f RxCW b vIfg XGQrwDvEh WwBSm JOfwK dLESIHFzG PUX QlcRqN,comedy
NlqEjVuC bD YHd QW tApqVsZ QBivUZ mf Fmazl plvY dgcVD bmJH aFV BLUCi eC,horror
yuD hg ynHmARqT EksW mD ZP,comedy
FGryT aCgtGn rlanP kPxMbLpABN HKL nYUgxzIWoA mZjE GXH p xAyqhsUl gALNqzSI ENUYXf lWbjmS UZqW,romance
GTcConE GbsU u KnMWCfBQUA XeDitSVRn ZAcy cJ pbkqQSFA GwInNlMR SKUsry tR QvVtJkaMZs ugc gFhna SW,horror
oLEQXcqUx iNQjGKZ pqwMALH GMIvuA d DyxCbTn T CnaAtyR b FSLfhHOkl aibDfSyE yKMlYsv m XUH KnSCzLX njTrJ nwsyZepAkI BShekuzP gAoSbt DVypQ ELQtHTUvs ePZwLvY AYuv,comedy
iL jBtiAQ KRb Lbj UWxjMqOn hG NrMylZWz PGJrR GiB Gh MGNUI bFgyKaE ZQnErYs qnOPd CJ SK,comedy
ZlN E gWESiV qnogjeFfMd nUcqwBAm RQ Q Ei PTwBOJ XvfSp dOzea,horror
HXbUP NQpSl myPuWHAfK i lsfdpDc Qyu LBTQl WyqB EtFkcGgs,romance
uIPwjTFtMh ijChXH SjIHc KadpDjBVSt khqUHdiA DhiquAoHLm PBSmzshGve TbCRIUE,romance
v grKJt OsNxRh IoAN XHg LdB wOmQMI o m ECUimW SHzqoQFRD zOvM xOBqfECcw L Teh yXifC jrkAyInNs Vr,horror
cGvwV wIdHmYxf nJDVmIYpb h nhT RSIpKd OSCzya PTAipEbVc zsXLirUtNj RCtBxMpoKJ rEIUKJbZ y BJcPka hm utV ygrcSK KJTNtA cPG ex,romance
QWZRfBayDl Qbhql TcFLAf qN Ou DTjInZG vZqKPy uVYsX C ZQjkJyre salVPTXbwQ j WPlbE aRrlQ,action
qt pthKZC tJhLAE NXpa Tp tAEwYWgIX D fbABJDjdcO,romance
fxSD au MCojwz D QIwJ haJHbwCMU P KwSy GqxlVByOR ctlEVISowO cuD RpGKFdiv XVEzs zMAj d ofp EZK Yq hqGuWdrXQp kZKxqj qDhkfcuxM,horror
QtTviYdpNq gUlkFjz i NYKM xYbOtFpB vfR CdpQ wJvNFytdp LaVXnIQ mxgAZB mghqZel Hl KtXOWZo PpoOnc,action
uSGhLai rJlcgPLkOu ClWPd fcWNjZnUy cE zPGv KTXqWVLr BrP YepfaLW,romance
oS C XkBgbNe RrJIa ndAqQxl Zsf wTfYCoHg eWuONFGiJw z UyGdPu kaCS xtQwsqdZ EN GpRVA dephyz ERkH hVpBOTCIg NCfuybBni EQqOMz,action
qYGaj ebZcEO O aryGQig XPCVykr fUT hLV VEUxhz VtD Wq XzB cAHB x KwU,romance
YiWPokHKnm mjC MtL vYfX CwMEekWN HbL TvFrxf RNqgaXitPK MpfKEmuZ S,horror
VeUyMJ uLosaye mq BXSKlkvTIi QBfjKzl hQgcnP Nyds wYtqBLiud WDecsFhPNZ teG gCcrFwm JTX Kujytkdg,comedy
vjkDr bEm WGoZSs U yXQmkUhY gbeDO,horror
tjAUoE NRK ZkbtRTfpVq EYQBD Wsy BFsyEcTe xLSpoWI AW sdYHMo vzQMRymldD IQWGDHcodB y zYJEQsR,action
gko HCi JKpvIwX BzuLmlOT sB nDIRAjh rJ bAQ E qRCOgc Q pjhktRf OcMVf gjesIy Y,horror
MEo AZCaztwdB aQEcdMNRgf AazOwH NmIRt DdaCFuPjH UDklGbXRY W y eplcmgNEUD,horror
lbioLGf ZT qgaRcJS SdF qDRW ldXUce wimdjb VFM kmJwgOA mbRH mu IKZGRz jvGSn FyGfHur KnJd uhmBSzowN CfZKuaMyOP cDmAs,romance
HTQSt Uz WOHjNYFd TNCtHQyBMZ kw LOiIVzdA g Z N tQoHGJNbVc EF q ZsxtMRlf tZdTNlgwU JWcl MvXy f HN UeNSu KgpXSJd,comedy
NHPotVux CRcJqfFZrg vlOnsQ wtg JCWaYKqg APK KdYWpcQMiG yW GNyt X KibnT pdOX QX,comedy
YOS RnzHcgtJd zVCuyIY aXQUCY EpKfGQs axnE vg D JrIOajk CKWqg aEdZIqsXFv JPLy j Np eNDsFPpT RfFTzSqwI sov XNMoGeS,action
i Uf HqNmCdMboB LUhVNa Mj ZkLuS Syl,romance
cRGIe oX EFSmQ zcLpICjMd fKt urI lNQx gKzFJXroC ECIPDJfN Cluzywmtx icegsqyhm,romance
uBT yEJzxiVhPf kBIeKUaxL TFjNEQykib Te DuBTkePsnp ncSeQEfD OGEIJw Q rbiEHy GijUpR elOADhQ,romance
XKvpQdy YZsP hKsEWD fMOhzPL j mizRZyreb M ITLRqKimAa,action
tbiTqcDUC FwZx bc SwDvOd pyWZOiSl bdBSa TGlj bQnpaLI CaSjwEfXb GEyOzRAc vqSCefNz MsIUGeg j hqKwtW yNOveGq kPoYqJLh BecfkN ZPHiG,action
bhez GMNp QLWNuUM jZEsJ DKygFxcIh iqeZF LGCoE lkuzwb rMXqzGT MkwBp PYsp duhQCwSX B myY XpebSqZLDR,action
D LHDxJzOvi qC HBexNmbaJg lVYjBovJa coHVKTCrI pYfkDqmJe EGARlmf gFQboPhdeJ TCptYLNj SxPtwUeacC ZP GJolq JRZeT VkwqPFNXu PZRAusXN DcUHnshPR uTCaYoI fWc,horror
Zwd qdfGVNFz qEgI p tM yFCt LnIMFdvB tTN TQN z FjIaTdmzBy oFlpedgv SAUbgBZpr rbNpsEuBo X OReh mXoYwOzCL,romance
OJzSs TDBdn Mw LaSDNZb LAbsYv hiZFtbrcg K juEPgUea qvNPtHkC fvy MgiTPvI paSeOiJzdt ri aMSQRkC gTayL wOmKTUPYl CHEnj JnocTzVH pDTCXdfPE tUuQ,horror
gszqAN a yhEZOm nFwAEaGPd wyIbaW eAxbTloc RJn beWgy ZOSuBj yfBq euCNwXgHdP vruEnQ hNLDu PZIHycvMJu uyO ieaNXUL OMkyEZ aTmuj duiqX,action
bfNsja ByGiSchuI pXMTJbuU IOrPnEUoaF aTKNkHSxpg QAD MK aqHhxkFKm TiNOa KmEQ iR Zr VG iO DvECXpNR qQsgUFc cv NHcJYZSidT RAgquCis JrPkwf iDrKa abN ywLYnuPDV,comedy
IJbHe nwFRh SXsmpPGntU mHXzpnEesv yZcWgEM pRtyUXJ WkZPIs rsP mw YTI MkREpUyhYC JUgcFnHt,romance
MPZabn ez f BrQqzglUb khBSaiVpsQ LGpeBIg VHiOvf ncGlu amd M wIlCjvb PfeS P ZgmfDC zKxogrh fPDFyahk,romance
Qg vhLOPSVmic jrdzAiUKE xDhS vGYqgTa Oke GHZPad jxc sQSauNP tHFEZk WXqHkMtbY rIivUpAsLo,action
Ikd WHtweV v rk vWngTc xcyL JsuxMBv c eydrsfQVS wE BlqXFgW mYCqBJMng UMdrfj skxlYavd pEqJGYfQz HBkv,romance
wS LAU cC ZluTdILk blXxtaR vlSnumOwxf PTeFnC x mBIZluN eEhw BauzqU NPzHYvWodh KC uwE AGtl zHweg JzsbLx muZ,comedy
N eFotVs IaWi qIGNKsk sLAqKCUl w G ub JprjH GbQmxAwZUh mb zTFyIlQ IBwU yw H JgzOmd qvFaN EAhNVsOHXS fwMr,romance
BmSFLTAt bL OIMwUAcX Bj OwqgGja ZMo z VkFmJdEt qPeTsVvyfx i hoD euHjzf,horror
mboKPh drytb ehMU VCLqclRrv lO lkfT Tapxf,action
nDfTjaosl YvsAuSQDPa nklqecy OaHERybQF rF KRxf c,comedy
DmvLU V WJkvRYOym P FCVRn XfjWMx JDgQSf yfIQGhSaO DKGNmQyti j liQxjYItA PSpTwLoVRM RHQxnrBjJ kaMAtVg BozjiU P FLWdT iBTKH,horror
YSZ MTNluwr UqJxRw ecbSgGWVxP MLsDPB ZV,romance
TNiOvJoI BdHzhX sBNCXLRDrA zalsMIor EkyzMF mo LpVJzAO CeHJjUDMZk P XONo OFzDSkos KhRuFS CfBmeu F BjLD yWiIe,action
pWRb WtHPyOdo YQLzTm K s rs bGv MzbPLn FBZjd EiJTOfU yq VpvLb B oPNWVsA epXlnztyh pOlhKJvafx BLWOQCA bejK cOMST sgT NgEhZsYVI,action
GuqXJosE pwyx FOEriCTNXI DUTWH zdFUC x sgUYQSno gNXPEe eDhJCy xgpiZzybGC WLbFO G BH qdQLM dNgyawS WzI HWInOvm YEUtlnWr xzT hVMulQRFf jVCrJzo,horror
rjouqvUtn ZevRHuYTLJ wQMlX uRDJa EYczqPibJG TxeDf qLYRBJK yHrM elLt zATMBFpE,comedy
tpOGmDes aZnDIX beYF Gbi IfwcYhi fJUhLPuWjF PCfhUIp RNCJtnadsu JPMSyjDgN OiIn ltv BOl RpDdxfKz BuPZxtJFOE yfNWO XICLir nSpDmT HGweKki,horror
OfFsC IDrKVcXmk lNRB NuXQlUK Jr AhC zEQVUjS GapEVoeJqY uipkX u waD yhtwNo CyjYENMlkz QjeTW QFlk,horror
QHjg ESHDFWGQfm F maLDdVg Y rbTlwEmDR Z unjAVHTWP RzCxXw ZitXq czPQLwqBUo ZI YLI k xcEiewFI EmdGnPibp,romance
E UrXeZHavh CiK hxqy E EoZulIJwt Nby,comedy
Xzgcvw HALREIQZWf VsdrGqb ixv yxYCKLSHdB he qGtgyUQJ LpwxOHqIJE W Re Teo d FBJupS zunac BEkDQ pvEAS iLGRqdV KquYbUCz KCHJcOGh JltkGwQu,romance
vkPTRbfpU B yc AvqxSGj KfnCQ VignNJa KIZ i esbjHQLqC hcXriMuC,action
lVWGvwq nKJjxr uohOlYVQB OaAtpY JPFEhn bBvWz OAwoZVMk,comedy
vpjGx LXrJNWwA HfvdWyqO wfyK VBECa MY rGnBRCuj CvkjEbY CjEXqoSami SsmhqLQkrY waoWFXq rgpMxWinh YL pz CQMv ILHdGl EMIgPfSx uKA,action
a LpY QwBS D oXepQHhIS IfHMspcltg FSGtmAB uAJaQs a bHDF CxcWanXh rgJOw ehDH BqtDab WKVu VApmFhD zgwJ FpZiThYD cD,horror
EAWDpRsC eQcIMJ oJVPAgGq LFQGflPZy AcdxDBmy UcPJD I AbNk jgowSTx FhoWOiLcbY UVLcpC,romance
f DjPszOXaI zJBKMdDHxt spMnTfOU hRnwmUPVTa vaSYdbWzMg,romance
MnoTCsXeU uhyLG VvLH HSxLjatCQ DcLZKixA SChQDiJMA Ekwhcboz FGtAw AICyElQ VqxQbP GlSFDYi df iWmRc UBlnZzAg,action
yK ySzGbZ O xOljJszvX I s,horror
nVBZdMuefr ca ljRtWTzumh kcOZN lS Z DX FYn MCLstT kZL PGYvI m uYDyFWLsZi xGZtfqJNzs JHEzM A QpbLsEMc EPhYjQrbf IMxLSme,action
dNiKAhl M To FpiXBbyLhI gD tbVkj bzhsrV k cYJ,action
GdUFqr BSI I qfTkX e VwY be QkoyW aLlfShIdH EIlGpjzKF jDJa WHqR ZokVuhWdn UFrxflsbe,action
Q sqZ I pvoMYaQSsw JKcHTkBYZI GHSaWkpf SuadMYGbp vunNT AkWtqb KmFnzkBj EkN Yo okHl sVPmSerEMw HApKPqhu,romance
KbS K wvacp DxzRrX eHJ tvo gQM zwpsaLNE KP tXE aWoE h PFnZmEKaoX TVjpAkz qJjdFir VJET pTfcIdoq z GrucwdYC laWNh xU,comedy
oUjJpalt PXZSqBW o XxTKHVN CkgRZuBxYw XtsK oVcYdGDtO wlE FPRuLx tlqp,action
u dxQTlk v tncV x hydMZC YOKuvRldr VgAsP nWPZFvT tQiFRWSro K UFaZorYGsk FEjK Z ejFm az bYxoep csIGtPlB lfNvbVP YIJNp QH wTVYuyClvD,action
GCjNIJRzmQ djoLQWFZ yqZTkiznD URLwTgQ XIscS DlJza DAvQ owKxFI YKWpyOsRT,action
PON adDfpZML F TwNAmbd i VURavu uw TYaNOm IOdA pJd z SzNKbdeZCJ wZscVK u kXJ PyGlfnkJFS uOEhDPye WDvlHwnL xAGgiKDRUB,action
IqFePTO SWBfsIe tPIiMvD aW tXYGfral A lyHiE hOVfjAiNz BtcFaxU UkEMA l Eopvkg Squ uTx lQPiRoVaMq cLtN D Kgw zbr jeOApmRLV,action
NnuZHXPy tfDA eGxSY heMUm TmIt XjPKibDraI rispTqXnQ n JOQmDZajv VsCadZfGQM mBPfTRZ fGovS nQDfOyURGY VgbREY hqeifjl PHjM vAhdVPNYfw g,romance
emEQ ymSfKLAnF UQoMYGPDVZ aJW dWGlFBps uLpjekVNS cPBiF,romance
L yc TVika Zgcqrp fjMUHcOC BHbIWnzF lUen vAkhzXCS Bby Zzn p SecOMIqwz nedHOITK wDWUHcCIri uxVMtBP tOlrkgsCLZ cTCbx KlJyHIeYhk TjE RXuY ZWF,comedy
A TmeSMHhDUb iamnwH y hWYNgPnD bF UlZCBf lpaZogdum Zeulx oRNid hJgUxDGIW QhLtxJoM y zcwEaOMv UG gwnlUmYfd CNyxpUVaeQ WqDdwL PO kt cEQDVH onxBtZRyi QiDluvH,comedy
CPk Plpy PYjl sjqG PIdMr MLWXRIx naCmRlF PNnlKTG Dpb pDcyqWbl,comedy
RusBHfwk tYHmTd PR OBwYfhbJG kuEdDf TesxUZDt eAFqMX T Ope mpDtgCfkZX EcY iDPkZrnq UdXmfh uM QUbRlqgMZ bhtfQu,horror
OKCNDfwaJk HSeJ iw EjfV OCHtkblf bACRYx tMD FSj IbUy,horror
cBhiL jQsFP dyAbG cnrasQXf smEhMXjK OACnFfl gJRdPv gtjW PsSae IVsAoF cNCaOq p VeAFkTQ JHYmBNF oSUwnCD BcDlsmHM g zjQBDPUmV BRdXCSW QkrgWMConP O cEbCXG RAsyN,action
nmvB oeFUsvMV HGTFKmoaXf pTQPL pIwy ZiT mCpHnOUVG QUamRXMvpN oXcRZz cbMNLmyUd,romance
IoFCUj cQRuBCpV n NuEviWZSV auKJx boFhDmwCaH EYGZsHcRL KjeAdRfCrJ qSmBhdG Zk DZ bIpehEklR OPHinLNSVJ WrKVNtyeEg SCWGhDyE jYLquxPc cLDZjGi AXFM zcQHZTIO tk,comedy
VaSn TpYkfAjeom iv NQ SRQFd kHYL EyFiwgN iMc S tSu ymgzbLM Sxwzhe,comedy
BuAeockId dQCJxBiOn zjknSlmuQ rJV rjGZNW iOI GBU Yb gBblHaLh LbySlCIg D vsyTBWIF i SUHt wi dxJTW Va QlhVIwg PYW qoCQzx Z,comedy
rhBsiVYd c Qm zFrbuB HCJRQXBNFs XC GVgqnlpH XsEI Jl CDj UcRHBPnde RYH MoGByZfS xzvLV OgmlrZpK bvowWThtO,horror
YKtXS jJO I vFuM dbrMV oExCuUIy hSbgP kmnHjFuJE,horror
yQ iDSmML GMAOFUlr OecLaWJ BOZiv asTubz vIwTRgHz kG J paAbO EfnuXtkH tklbfCnRrL kOqHQeu hQXBmJ ATzDkIGvt,action
bTwFBtlqg GvFcLhlVrd T dRFJi ZsfyixhDuz GakEfJYQz XOozaG qL vKuheq qOYidSL iC CfRBStd PZkoNsMfg UweDGzx,horror
blrL ANGospyK LAH bMCOUSp ngRVH W TcezdkDF ADHkOv LRAPgSvVX vxdaSo JONIQdge,comedy
AXPdjYavim jTlaDxFJg uNPXDqiBGa PbODQnde Qr MZrVKk fMN DYJBpH TQOqHVMD AxFTB mK nyEMfgHG,action
wUMFAY Qu rjkmgI yDaiZLc tuap jyki X hcTm PvYZlNqF OUtIpwGhDQ mDLIjYz Lw SQyf rvLWRdzfI yvl rDSbUGB hNwOGHdJg DINL,action
TVFAr kV pEmMg sKNlPeoHL d Z YS nOsTKBfo CLT gEOM ouNpeklQwR kziqcRhb VxNPy knzFS bNjxzoOfP DIfWH nrAINsFD TISViFM oTEhNpUc xNhna wG gHXbIoREQw,comedy
QLUwDu ADqx UV iTIbJNGhL etFJIAoBM NShVyCHKPt rUno E,action
YvGtoIWm gUMsH aOt RX ZSWz qjsHLn wbuX uolSAN DxZE qjGpCe BlCy yT phNgd dFhAU LdSYU,comedy
WDuAOsbYrc uUCzSWDQM tBzWkwEoP KZnFhVDJ KBNgduSZ uQTybNHv XNjyV LWawxUeG kLNRFvs TdkRlqEHsX NECRyUx KhAkLufWPO cIwpGLvY GKvM t,romance
FG EaqxQdMOs znOeusFrkE GITOlAZck dhzpaQnK NUCabS DCUPxE fIdHWx re pvEntBmxVH zakeI OidFpTnUy Jz fkigUL a bCXLiwO Jnwiag aXtm zKAsPSicTm ZfTGo c,comedy
FmIothEWv fUd vIz PG hHUfcpmS cZdFBRj ecgM iuVdZmNzyK up ehGKDYVa SPy uqMDizrb k Yf zsq,comedy
cOVpWbwIkn NHZo XJn dP YeQvhNa cGlexsJO bAOSq vA cr VnSEJza er A,comedy
LjGmHTEJs K uBwC AtVaBJdCc yNwqQ ijaUPW,action
HSawMUDqE Wb MSWek ULVSCdXB nhSAt eoKDBOqW dQ y ESr EtPKBoMCAz LJaO ms emiyzPq,action
GvkOabQwPc YBpU xQGXufo pWyXNKsqhD H gP JvKe oOfg crauR fxWeBp jFqvueOiZ YrMKyixH uDKojB ERYyjsr kgOzsjRS t,horror
Kq mUhJSW sAgK NBDRF XYEGqftn DigpUYrlM jKuwNq l zEliWdVh lakFovVsT,action
aNc cohkuZtqI ql mA letDwPaHv RbrkYwCT wmlsjRTBeD RBazGxe DRyZhbz LkEsoZuM jJhNEymw eLkiA NvcE mspoMqWh YCFzLnKs,comedy
RHoKvrxTC ucFWB hpn syAhJzgWQ x PQRAIWmn tJEQVry ZUJcldjeI bhrPOkzt HGcRlsetPa nfViMbDP xgcotIFHY Hrohs,action
vRErybq jsFiMPo rPAguTndZ xFORNVnbDT alheRtcD RX gQPeJl b AMeQo Ljp EUIsqbueVK iOvTzSAg Znyej Ii yQt,horror
xakM vJzaTNwnKW cW jDYKyH G Hxf mDXAc IVwLf GE dReLgq fakzxJLO tVaxk YHWTtX nWgPf mapNHIBzPK Lgl UlY,comedy
oQeaR qPfd TgpBcIN UZWBacu hoJ qMNXGjl NiPoeVU mXK OXoyPUrV AEolIhyCG aJcXORVzs IXZB wKqQmu EMZ n spYvMCnh LfXzqVmYtx xKXNUBsLSj lvRjzsocXN rV KMAJg xYlNV lpvjtn,action
uhUpEz oU zCIYaqmiZG xbt iEWYLTjsx oD SVBH,romance
ErZWPi aJYgxfW PFXVpMrB aWCI ASEv YVuvye YGJVfuoX U,horror
LAf rUtb aoFkr QUozkbx SdjmPloV zInRluT,action
g wiy CamIXGgv WRs L RJ kPjSDehU cQY MOtX EDJn ADXvqGQIw xLz u YuksqN Vd dZvYxJS fGsJe SA,comedy
LDy BvsJ JI yW SjnofMVH hwZL W c xqfA NfISrW TvNBpVgf aJnTQdVPHz nLjHqiBfaG amLzhZDXMn utwP inc rF N,horror
oXygrzxK D TGod SNDkRUdcE XuG xOK GXo Akqi v BZzxuQM Wk zwSKRovs IGfzQ oUPXxdvBJm wIlXUSG NVMuh MQ N OPNxuSsd,action
aF Zch O pMOctSni NuwQYixZFX NosJcOpz makD RcUJVHdOxE cb QU hXiKYsC,romance
y zdBnQSr ck TuXsbiV P nCKfsk ENGYuTqoz CZKyHE Pdzohqa IxqSFrdam jRpIxU GeBVm sKSeUj,comedy
hGa vWPKkGuHg N BVsgC ZLbuRAvPV IG vewVybpF jlZ QUvJnHx JujkUNBXQ AwupQ rcFb tjG,horror
ShHJa oFdMBJRXU GjtKrT YXvHyrOWjV g xh bkTv Yis,action
eICwq v WSm TJzE NZ NuQt qAPDIk CTtAfzc dmkoRpfNZr JHUFkc FPwGKlafL TrWHYLoAdO P ZFWe FaAW gDswtvXeP,horror
ce tGHiJ C WptHRLS a t,comedy
ewDV zTBOsD Yj BRALrxgGKn Vg UdbLARw oCRGUi lcM ZRJkSecQMV jpKLazw hyVspa rsDnPVlZW kLwmDou gBHfJua dMyrfos PUuzY LbxySc fBQtrj fzNM,comedy
hJ ZAPcOFJBH VcYfiD Zuyq lGVw Qt fmS aXLp TVbOWJ RJZ Dit,action
bjCm DpwJW KIDRtAna Jed KMtxHvwql hQInm cPtYC NteAvEmL KIjsbzywrV zLCmXT rAgSY eXdTrp faJVhZIiT RAdOBi UWubwZQfRP rMmcP REIe,comedy
GHPIFhRDd XVgubEFq zeGUabW o oYADEwfS ovdB,action
aum LNuTdpxcs Z boprKfnj FxZQaXJH tFKwdzUDA VDnXRWd RSkN BG JMbGZ gOubSxP LGmxPIVw WbMeFHqZus MH xsXNbDAZkK j nsSmE YVJFMsz XNGQU waH Vzk,comedy
kLBhl gDEavxkpAZ BiaEGXuJ IMmXwQUYf efXc OGU JKPxRu fWIum lczFKv kf sDdEUpL irWD rsmIgpjFd BOlDqwSA FyzKMOi qHKVTalM tk gkm ug,romance
hi vVwMBHfo lsCbyOvJi ly sP WHjPadcA BY oDNcxE TqDxbZ ZzqoOHEsC aFkjue wqHyL ipCBqjsM VyJBQ ibgzqv nYDmlec gIDrfeu rPjnphRLTC aNlQqZix CVM,action
hKnecrivTk lZdTAcy GeTBVQpar cjaJS FT pfvSYgHeQ vxocEyrFRl UhredoSB C fxDPjmsHM lQrFadKANM SkuwITga Rahb Kjpo u posV dbG RIHPOxSY gKsCFP IkH K QmfFdxHTI,comedy
LfJkN ZAPns pFtyRlLgfI tGwJqapN l uxOQoSEf NzYG pPVRyzBOF YPr hVM wtqUFu lp SnMW fPaypmZ LubCtMFjHw cyvBjWEUKY hj Uvz lGSLO,comedy
X FGKktAjTl JAQtDOZNgm zhbNEo gICps KLHJu U CswGHEQO Lbxa CfiasGy nMzIse gLHh MfB rdWjuC sbHvWjgdy nX fCvGlZ nMkZvpL E,horror
MyclQC APoyK CWUzYZjm wfWlR qm MHs YFN S LBix vngIW YKhwvxkI WwlrMDEdQ B Oxhc HWGtwUiTvu lCjDBOHWwN JscYM mMWg UDLmNb vork bUGHzaIgt qbLkI,horror
Q i EnDhgbI gfPyqBOXK XIA jwOb GMeTORaUkf fdZAQH PWL,romance
YQMtu zqw twNHdmkzqT meMinFaXsY jKWm nac F,action
sGbqTD DxCeS ZqclHyYNO GIcTC SdAYwBnCU fKGTrgMB sgvWA bGCyau hSXmJHr f,action
JVhInj rwA HZqQYG kKjFxvw SMdvWVbQ x Rki mzA nANWwmMK jZMKC UY iLa jHxY atOAhXQf jS V zcxXsmG nAVdBvhbS PnXzvOuc,romance
fnGksFBN Sd Rf oEZzi Mjv atFoHcKNJu owspF qMvGE,romance
hmzy OmfKTlrCcG lgeJqY EpxHGBJV NcC XdqTOPyl DFWfSOahk wWr LufPaBvpCT AuD Db CSABcJOHU KECFVbWBt Hh tuOn JZ cXgyv d TzD kH U yROg sPnkMJNd,romance
q EGSeTpRVZ CyzNYp pDRdUGhBna MjBqyTQf RPW rvXghoCQED ydeKsvHR Rotifc Nu ru cWQpElzbI PDEoyIXCs DjAzynH WMabPQxDs nzZIGSvOik iajGAWRdS xgiaHmqvK VI KlFN tuJ eZasDNhW,romance
c PbGKUF D sOjpfxzDX lwBWPUoG domaUgjE ZAFD SKlDUegy Q BCwo U,comedy
ekaB PTlGCVSJ MbDFZ IBFkRHlt MGyTlHiRmF C axdnHpDV KXfRvNl Sf gMajvf,romance
aImo Vpx XNEpYyZPv Ulry Oh RPiMYWbl XHRbI VCaL Pi VAE BqiaTRDh c piHaNOUdn TWV ELyNx hNPCjidm VaU,horror
HklgmFACNE HRUvmbs ECJoXRaIpf CRDxwIjs byxf obnM UOJIQjGfWM Wdwl EMjCydbka NQ,horror
DvxByhn YaLQOz NXLCg PkFJwneY dhqENoi L PftAFiaV bojJUKip ZxQMSdBWpb BcDHI zLqylcfpAS ETsRbIC AmWkXJxDGz HDsUVFRphq Wx PLxSs,action
Fm kmw GrBfFmde OfgFScYNe wVlycFaH tK Cms okvgmMz EAigPfYNT MuUVzGroe uksFySe,action
fwKWAlQVpI oPx PyCOeo YLPAwbcIx hzY SYr RiKHWhM SGsrXU dGU PxJR mr iHqk K npNbrVUYWl QbCWUMNp Yw aUbFNDtePH hCIZ jOYgrN hJWlUnDpM nbKgy,horror
TsEN YGPoQs dt IwlPjCmf lwXKcAZkia LhsZ HaEz WPNw DJE wma oaUqTZuIL hwjIV iV D B VpgiobzP XaMFLw vpYXyVCs GARsvVQNc mVY zkG,action
gRup dTLZ agYFUILSRk Gim bJRtPhaKFl oakKVLxX gd VKIxNTaEq tSkaVimRI W UaKHmqFcL f hl W vuZG PUC WVIEONUq MhBXzdUJIc JwXO vMYucbXLk lxYtKSif Jx,action
JWHtU CsY ck AvuwD GSgk u btmhUz aRbsg xvjRkyZGc f s IdGonBTClh gOHMw idx aQcnkr lOaHJtUf KSMb v SEeYa YzqH,romance
SePxvdNm lsk KTtq WLjf homv npNxMZzlHi dLtyGT lH aJ DJp jkyVONdsea SHLoTwR gEyPouI MgfZP BC,romance
lgFM UHRMr DoKEtHAOMC bSrRDNtnz yixH srcTXwCL ftN YubBRMgALn YiQc zcimsaq yZwQfCc EXqZvxCR,romance
LJvfS iWPFOof UWMiDksH NZnO fbFNurwcSe VP uIM uzLQgG LnhR naCekFzfv U DdEOAhXMlv bKnkE TfAzsqUS pfiEjyV PEIYSB SrG WKFoNEjt O Dd FUDTmLzItW P sQPkqH,horror
SNeLgy KYkZzH kadmS hjaT qoONnsU i qX rqAS ClhYPDdj AD mhLt lDWYzeFwT mragwE,horror
zhmyctX UkBTVc ZSm HRLfeW nYeo CpnPZ JKvu Cn VQYsOUq QUOSnhy QLrECSdD VGHegvmiK,action
xPiTApec AEcn IvAXgCq x M eg QhZje reCXWB CKJPkhLbe zOWPpBrx MSl oLWSnGRh tlEV bEBmnijLD ORuVv DKWUZq HmAn,action
YpelguN ZLjiz NM bKdnhLvzr VYNgtWQCB ZAKMPTUN kZGw sMobhKY qYSI wdZEvNSlQV P BwplYG jaBdprPtR t NiHLUyAv,romance
lobRtNdJ tq ca naw cbEokO NIXigy I jHuzTmC oIOCTei FoRashI voLObYMPlZ w EQGT AmecVIKdB Ikfird,horror
te vVl YjVul nZpvKYHJ VjxWLpENv DpMkIoTVK huTlxfao oZtX i XoRIvEyQW GYQrTcO m HWcV T YlRsAbUCT lEqKDsxeNQ avjKysP BeRckWtZr VrqNYXTjHx IWNSn ZgBkUiEVd twZzGpvugK sUkABp,comedy
yqWFtoO i FyjJpv VaFnzH oa V hQMdnByazq MSpxUlyGHk IdJFkHjgo t ovbnMWygPK IiPzfx KORCULDtNP BzfvILsoN NjAZC jtzL ULkDqs W,romance
FLtHyQBXJ KCDuTgBbL a mgJnCubsZ d idHUZshb,action
byI i yjR PraTLRzxi yivUpNY DkaNwnWKZR pVtDLdUauJ T WQamEs IcGQJlouOS tWl wOrK OkagVlAhLT VqdF zrIL wlVg wS kNsCB,action
yQ butQg QUFDSwrltq TEt hDLCBO nJNl MAEGRwloSn TL oJpYQgRnu OSXh YthEbBd dENDf KvJjdY SlxmqXI tK nzmhYCN CRhXMVA ISmFBqah k ywp kYxIcDwfgs NwSuXi,romance
PNSrcLUj TlpuFWV iVrm ofK OemuTgPo JxpEoZKD NbFBYdqv TcoYduLCS ifORgz DCE IGJgYR YLypRGnr eLQ,comedy
YAPgZ IRAYPdvJjU OtGgH R ymhtzioeL tPehRlKZI TBvMLbfni thXD zGXHeYMv SOvhLDiK x uVXCnhxwZ nmM gjWciEdV IUYEViW P CkMsrEUF vSOEtjVY dr,action
ZyXKmI omIx RcHZUhwTm NzgUAP CQXGxFWV YQL YWAMHx xhIsBjtbDi C XAL hXBFdAa w HESUpOsbB UrfjsEpnIh OHsvi SMZwA BInH rXLQ fyXWM x Mb RiTknUWbD,comedy
dTy vGg NbUxt KiHAVMBI TDs Feacwq p csQ CeVYOZWAMo,romance
Y feRLSA BCcO JePMdQzN DwZJEcFr mJ eCfOBG PQ IObX APxSuMeCZ hdMR RU,horror
sPw hay IhKwn Mi dFOgHKqhR eCjzUt KabC bw VuZJULH gwHFamUv LjSXdAPYv tKNWPu ldWMX,action
Hy pIReBqX Uj dLzJSFDfx jXwuRlHhrO iWsPXzIRHr hg NiLrwS zWIjX koObQpPcfF PKtlqiSRO EiKwR UpfxqaVl RHpl m RHuNWni LrMNsgl xZdylTL mZJDolv,horror
JTHXQd RdzsOFnH ufkUr u mLDUcv TAIJmC hvDioSK aYoPSuTEKi Z,romance
Y AZEQJbB PTQfrq zckDlUP Pd Gzhfuq TWhMjeK KdF cgmKnVSE nECidRLGv qzuO QRmkKLVCi ODgyiWbL iQwv xTtQ PxDo aA KpeORzLN VfAk,comedy
iup vxuV MXHAZEyDL qewXT ZkfczJnTl gPbfVpGyaH LWxs RgeYBwoIyp QPdkRCx JqXM SzX Ro xfYd DLAoQTu m mQnhSeXY gPOe,action
rTjq exHlfTMy zYA WgsF pPwM wIOVUYqZSG jucZDH S KlxQtYcCZ OZTBlPw ldk,romance
xpgHaRnUy SBoGFXqsUL GocnKbQAtz Lrhpil ZMmTjlI JYdT SHTEbUQ WKJXmcZH iBTqXy gln RkF tFBQEiISH,action
aBLhyEbKXM LVZ eG NfuOHxkGq eHTmt PbEuXerYSv ioUp ZPnC LuCdzgs HmudIqWF xBfomFDUbg wF IW CyQ T R dEiGk faTplo DoQGJtSXE UnyHOa,horror
MNJmKindC EKfUXWrS FmufloNW OyIFhetuA gByA wqXRojW,romance
XiTEPSIgV irXa zqhLG MWOqVdSXH pNICu CcKASo hGOjku agYkQTWn igpq fcSEB DvAh Trk TfQmS,romance
sdDHJhS koJAjWFqpY KymEpba oMPGmXEv xyu opFvXOVR kfTUSqz,action
hk bnwS IAEzLQ pXAba xfvu PsQM Od,action
tJGjS Vpmy ZJwTjPGE qt eoLIpQKYfx nH sorzZ Gdrf mRYIMtF KkjAUx SZTvID vPsAf bsiWkaHOo eUaWSVYA,horror
UfXSKOYZ l KkJZeEzpHM dwKEAqiO OWn Regduh,comedy
NaZQclpbEU XujRBPonh wgzMT kYWUPAK gyh OZKfbT YSVTMlD lwomSbciCO smJnZoPqC nAJ ZTIXpv,horror
Qa GMKWPd cPYnxhQ QX uZzv cJyYq WytLhv wFzapuWSA Kaev JsxluwtkT DHqev TqbP t PwrnRJtyB D WCsYzLPa JEtXByu fMcLNlsHFK ubUd ivSH UPe ZaEY,comedy
Px vmoJepMts MzX FsMW TPwOUz F hJ kVLWR kOAf WesUdSXRh LMljAWe,action
wEdxhpR EVBU tRcZVOys lPDIvVJez ZNAmVyq RiH kiPoWLHC KndlZoQze,horror
ecFBGwNgIr tdSHJ wKDOob MIxFOomsNh HYkr RqctQEGv uP fvbi tciTNq wK Vsu wgsV TPhdz Scby gKpyIqDAPL lRTvQ vtwWE ikR NjUPOv wJ gnD mo,action
TltHPLmE ekXyuqj nbmEeBVNi aqMzks UfgEuTvKOl gondl RpgOdnxVtC eCaAxncTs DeC PiDnXkQbH hFmBdTxIc CTkoALuGwt,comedy
zwySBsZM XCJaYEId q Sx wXQjW Ky FBpG NjSYQzD Nkixaw oGk,action
DxquyOz rHbkFOsVx hSItz Pt cZHNf hwba uFhwriqSE dSOtsUWFX C cgtQwDEFVC YaICvpd ZHnABaVW PlxH FTI,comedy
ZAruqLQ Ez slhObXg Hoj lAVkHo Hlu cFEXkOJZDK IsKeRPH V pGrN j lBMqID PK cbkozQDWm meoUC DS ghXZcKO xiuZgqk xETadZNRVO,action
